INFO	Title	PCDC Data Model										
PD							Black or African American	aml_v2.0 | gct_v2.0 | hl_v2.0 | nbl_v2.0 | nrsts_v2.0 | rms_v2.0	A person having origins in any of the Black racial groups of Africa. Terms such as "Haitian" or "Negro" can be used in addition to "Black or African American". (OMB)	ncit:C16352 | C16352		
PD							Multiracial	aml_v2.0 | gct_v2.0 | hl_v2.0 | nbl_v2.0 | nrsts_v2.0 | rms_v2.0	Having ancestors of several or various races.	ncit:C67109 | C67109		
PD							Native Hawaiian or Other Pacific Islander	aml_v2.0 | gct_v2.0 | hl_v2.0 | nbl_v2.0 | nrsts_v2.0 | rms_v2.0	A person having origins in any of the original peoples of Hawaii, Guam, Samoa, or other Pacific Islands. (OMB)	ncit:C41219 | C41219		
PD							White	aml_v2.0 | gct_v2.0 | hl_v2.0 | nbl_v2.0 | nrsts_v2.0 | rms_v2.0	A person having origins in any of the original peoples of Europe, the Middle East, or North Africa. (OMB)	ncit:C41261 | C41261		
PD							Other	aml_v2.0 | gct_v2.0 | hl_v2.0 | nrsts_v2.0 | rms_v2.0	Different than the one(s) previously specified or mentioned.	ncit:C17649 | C17649		
PD							Unknown	aml_v2.0 | gct_v2.0 | hl_v2.0 | nbl_v2.0 | nrsts_v2.0 | rms_v2.0	Reported as unknown by the data contributor.	ncit:C17998 | C17998		
PD							Not Reported	aml_v2.0 | gct_v2.0 | nbl_v2.0 | nrsts_v2.0 | rms_v2.0	Not provided or available.	ncit:C43234 | C43234		
VD	ETHNICITY	Enum	n/a	aml_v2.0 | gct_v2.0 | hl_v2.0 | nbl_v2.0 | nrsts_v2.0 | rms_v2.0	A social group characterized by a distinctive social and cultural tradition that is maintained from generation to generation. Members share a common history and origin and a sense of identification with the group. They have similar and distinctive features in their lifestyle habits and shared experiences. They often have a common genetic heritage which may be reflected in their experience of health and disease.	ncit:C16564	_undefined_	_undefined_	_undefined_	_undefined_		
PD							Hispanic or Latino	aml_v2.0 | gct_v2.0 | hl_v2.0 | nbl_v2.0 | nrsts_v2.0 | rms_v2.0	A person of Cuban, Mexican, Puerto Rican, South or Central American, or other Spanish culture or origin, regardless of race. The term, "Spanish origin," can be used in addition to "Hispanic or Latino." (OMB)	ncit:C17459 | C17459		
PD							Not Hispanic or Latino	aml_v2.0 | gct_v2.0 | hl_v2.0 | nbl_v2.0 | nrsts_v2.0 | rms_v2.0	A person not of Cuban, Mexican, Puerto Rican, South or Central American, or other Spanish culture or origin, regardless of race.	ncit:C41222 | C41222		
PD							Unknown	aml_v2.0 | gct_v2.0 | hl_v2.0 | nbl_v2.0 | nrsts_v2.0 | rms_v2.0	Reported as unknown by the data contributor.	ncit:C17998 | C17998		
PD							Not Reported	aml_v2.0 | gct_v2.0 | nbl_v2.0 | nrsts_v2.0 | rms_v2.0	Not provided or available.	ncit:C43234 | C43234		
												
												
TD	Medical History											
TG	Refer to each data dictionary for specific table implementation guidance											
VD	HONEST_BROKER_SUBJECT_ID	String	n/a	aml_v2.0 | gct_v2.0 | hl_v2.0 | nrsts_v2.0	The identifier assigned to the subject by the honest broker. An individual, organization or system acting for, or on behalf of, a covered entity to collect and provide health information to research investigators in such a manner whereby it would not be reasonably possible for the investigators or others to identify the corresponding patients-subjects directly or indirectly. The honest broker cannot be one of the investigators. The information provided to the investigators by the honest broker may incorporate linkage codes to permit information collation and/or subsequent inquiries (i.e., a "re-identification code"), however the information linking this re- identification code to the patient's identity must be retained by the honest broker and subsequent inquiries are conducted through the honest broker.	ncit:C168949	_undefined_	_undefined_	_undefined_	_undefined_		
VD	CONDITION	Enum	n/a	aml_v2.0 | gct_v2.0 | hl_v2.0 | nrsts_v2.0	A health condition or medical problem that was diagnosed or treated before a specific date.	ncit:C54056 | ncit:C83118 | ncit:C18772	_undefined_	_undefined_	_undefined_	_undefined_		
PD							Trisomy 21	aml_v2.0	A chromosomal abnormality consisting of the presence of a third copy of chromosome 21 in somatic cells.	ncit:C43224		
PD							Trisomy 21 Mosaicism	aml_v2.0	The presence of cells with and without three copies of chromosome 21 in either somatic or germinal tissue.	ncit:C142099		
PD							Other	aml_v2.0 | gct_v2.0 | hl_v2.0 | nrsts_v2.0	Different than the one(s) previously specified or mentioned.	ncit:C17649		
PD							Unknown	aml_v2.0 | gct_v2.0 | hl_v2.0	Reported as unknown by the data contributor.	ncit:C17998		
PD							Not Reported	aml_v2.0 | hl_v2.0	Not provided or available.	ncit:C43234		
PD							Turner Syndrome	gct_v2.0	A gonadal dysgenesis syndrome occurring in phenotypic females, characterized by the absence of a part or all of one of the sex chromosomes. Signs and symptoms include short stature, webbing of neck, low-set ears, hypogonadism, and sterility.	ncit:C26900		
PD							Klinefelter Syndrome	gct_v2.0	A sex chromosome disorder caused by the presence of an extra X chromosome in the male karyotype. Affected individuals are infertile and have a small penis and testes. They tend to have tall stature and long legs and may have difficulties with speech and language development. Gynecomastia may be present.	ncit:C34752		
PD							Swyer Syndrome	gct_v2.0	A rare syndrome characterized by the presence of a small lung as a result of unilateral post-infectious bronchiolitis obliterans.	ncit:C85178		
PD							Frasier Syndrome	gct_v2.0	A condition, which typically presents during adolescence, that is caused by WT-1 mutation, and is characterized by a developmental sex disorder, FSGS, and may be associated with gonadoblastoma.	ncit:C122805		
PD							Gonadal Dysgenesis	gct_v2.0	A congenital disorder characterized by the presence of extremely hypoplastic gonads preventing the development of secondary sex characteristics	ncit:C61420		
PD							Beckwith-Wiedemann Syndrome	hl_v2.0	A genetic syndrome caused by abnormalities in chromosome 11. It is characterized by large birth weight, macroglossia, umbilical hernia, ear abnormalities, and hypoglycemia. Patients with this syndrome have an increased risk of developing embryonal tumors (gonadoblastoma, hepatoblastoma, Wilms tumor, Rhabdomyosarcoma) and adrenal cortex carcinomas.	ncit:C34415		
PD							Central Hypoventilation Syndrome	hl_v2.0	A disorder characterized by hypoventilation and hypoxemia. It appears early in life and is not associated with cardiopulmonary or neuromuscular abnormalities.	ncit:C98889		
PD							Costello Syndrome	hl_v2.0	A genetic syndrome caused by mutations in the HRAS gene. It is characterized by developmental delay, mental retardation, loose skin folds, cardiomyopathy, tachycardia, and structural heart defects. Patients are at an increased risk of developing benign or malignant neoplasms.	ncit:C84652		
PD							Cushing Syndrome	hl_v2.0	A syndrome caused by high levels of cortisol in the blood either due to excessive production and secretion of corticosteroids secondary to pituitary or adrenocortical neoplasms, or intake of glucocorticoid drugs. Signs and symptoms include a round face, upper body obesity, fragile and thin skin, purple stretch marks in the skin, fatigue, muscle weakness, hypertension, diabetes mellitus, hypertrichosis and amenorrhea in women, impotence in men, and osteoporosis.	ncit:C2969		
PD							Denys-Drash Syndrome	hl_v2.0	A rare congenital syndrome caused by mutations in the WT1 gene. It is characterized by the presence of congenital nephropathy (diffuse mesangial sclerosis), Wilms tumor, and intersex disorders.	ncit:C84668		
PD							Down Syndrome	hl_v2.0	A chromosomal dysgenesis syndrome resulting from a triplication or translocation of chromosome 21. Down syndrome occurs in approximately 1:700 live births. Abnormalities are variable from individual to individual and may include mental retardation, retarded growth, flat hypoplastic face with short nose, prominent epicanthic skin folds, small low-set ears with prominent antihelix, fissured and thickened tongue, laxness of joint ligaments, pelvic dysplasia, broad hands and feet, stubby fingers, transverse palmar crease, lenticular opacities and heart disease. Patients with Down syndrome have an estimated 10 to 30-fold increased risk for leukemia; most have symptoms of Alzheimer's disease by age 40. Also known as trisomy 21 syndrome.	ncit:C2993		
PD							Gorlin Syndrome	hl_v2.0	An autosomal dominant genetic syndrome caused by abnormalities in the PTCH gene. It is characterized by multiple basal cell carcinomas at a young age, odontogenic keratocysts, and skeletal defects (bifurcated and splayed ribs, fusion of vertebrae, spinal bifida). Patients with this syndrome may also develop medulloblastomas and ovarian fibromas.	ncit:C2892		
PD							Hemihypertrophy	hl_v2.0	A finding indicating the presence of greater than normal asymmetry between the right and left sides of the body. The asymmetry may be manifested in the entire side or part of it.	ncit:C88541		
PD							Hereditary Retinoblastoma	hl_v2.0	An inherited malignant tumor that originates in the nuclear layer of the retina. A predisposition to retinoblastoma has been associated with 13q14 cytogenetic abnormalities. Patients with the inherited form appear to be at increased risk for secondary nonocular malignancies such as osteosarcoma, malignant fibrous histiocytoma, and fibrosarcoma.	ncit:C8495		
PD							Hirschsprung Disease	hl_v2.0	A congenital disorder characterized by the absence of myenteric ganglion cells in the distal colon. It results in a functional stenosis of the distal colon and a massive distention of the proximal colon.	ncit:C34700		
PD							Li-Fraumeni Syndrome	hl_v2.0	An autosomal dominant cancer predisposition syndrome caused by germline mutations of the TP53 gene. It is characterized by the development of malignant neoplasms at various anatomic sites. The malignant neoplasms associated with Li-Fraumeni syndrome include breast carcinoma, choroid plexus carcinoma, adrenal cortex carcinoma, gastric carcinoma, colorectal carcinoma, thyroid gland carcinoma, kidney carcinoma, prostate carcinoma, astrocytic tumors, medulloblastoma, osteosarcoma, soft tissue sarcoma, leukemia, and non-Hodgkin lymphoma.	ncit:C3476		
PD							Neurofibromatosis Type I	hl_v2.0	Progressive, symptomatic neurofibromatosis type 1 associated with plexiform neurofibromas that cannot be removed surgically without risk of substantial morbidity.	ncit:C143014		
PD							Noonan Syndrome	hl_v2.0	A genetic syndrome caused by mutations in the PTPN11 gene (over 50% of the cases) or less frequently mutations in the SOS1, RAF1, or KRAS genes. It is characterized by short stature, webbed neck, hypertelorism, low-set ears, deafness, and thrombocytopenia or abnormal platelet function.	ncit:C34854		
PD							WAGR Syndrome	hl_v2.0	A very rare congenital condition involving the complex of Wilms tumor, aniridia, genitourinary abnormalities, and mental retardation. Wilms Tumor-Aniridia-Genitourinary Anomalies-Mental Retardation (WAGR) syndrome involves deletions of several adjacent genes in chromosome region 11p13. Two or more of the four conditions must be present for an individual to be diagnosed with WAGR Syndrome. The clinical picture varies, depending upon the combination of abnormalities.	ncit:C3718		
PD							Werner Syndrome	hl_v2.0	A rare, autosomal recessive syndrome caused by mutations in the WRN gene. It is characterized by the appearance of accelerated aging following puberty. It is associated with the development of diabetes mellitus, atherosclerosis, cataracts, and cancer.	ncit:C3447		
PD							Celiac Disease	hl_v2.0	An autoimmune genetic disorder with an unknown pattern of inheritance that primarily affects the digestive tract. It is caused by intolerance to dietary gluten. Consumption of gluten protein triggers an immune response which damages small intestinal villi and prevents adequate absorption of nutrients. Clinical signs include abdominal cramping, diarrhea or constipation and weight loss. If untreated, the clinical course may progress to malnutrition, anemia, osteoporosis and an increased risk of intestinal malignancies. However, the prognosis is favorable with successful avoidance of gluten in the diet.	ncit:C26714		
PD							Diabetes Mellitus (Type I)	hl_v2.0	A chronic condition characterized by minimal or absent production of insulin by the pancreas.	ncit:C2986		
PD							Goodpasture's Syndrome	hl_v2.0	An autoimmune disorder characterized by pulmonary hemorrhage and glomerulonephritis. It is a hypersensitivity reaction resulting in the formation of antibodies against the pulmonary alveoli and the basement membrane of the glomeruli.	ncit:C34649		
PD							Graves' Disease	hl_v2.0	Hyperthyroidism associated with diffuse hyperplasia of the thyroid gland (goiter), resulting from production of antibodies that are directed against the thyrotropin receptor complex of the follicular epithelial cells. As a result, the thyroid gland enlarges and secrets increased amounts of thyroid hormones.	ncit:C3071		
PD							Hashimoto's Thyroiditis	hl_v2.0	An autoimmune disorder caused by the production of autoantibodies against thyroid tissue. There is progressive destruction of the thyroid follicles leading to hypothyroidism.	ncit:C27191		
PD							Inflammatory Bowel Disease	hl_v2.0	A spectrum of small and large bowel inflammatory diseases of unknown etiology. It includes Crohn's disease, ulcerative colitis, and colitis of indeterminate type.	ncit:C3138		
PD							Juvenile Idiopathic Arthritis	hl_v2.0	A group of chronic, inflammatory childhood disorders of unknown etiology that primarily involve joints.	ncit:C114357		
PD							Multiple Sclerosis	hl_v2.0	A progressive autoimmune disorder affecting the central nervous system resulting in demyelination. Patients develop physical and cognitive impairments that correspond with the affected nerve fibers.	ncit:C3243		
PD							Psoriasis	hl_v2.0	An autoimmune condition characterized by red, well-delineated plaques with silvery scales that are usually on the extensor surfaces and scalp. They can occasionally present with these manifestations: pustules; erythema and scaling in intertriginous areas, and erythroderma, that are often distributed on extensor surfaces and scalp.	ncit:C3346		
PD							Scleroderma	hl_v2.0	A localized or systemic chronic and progressive autoimmune disorder characterized by thickening of the skin and the connective tissues. Localized scleroderma affects only the skin. Systemic scleroderma affects internal organs, including the heart, lungs, gastrointestinal tract, and kidneys.	ncit:C26746		
PD							Systemic Lupus Erythematosus	hl_v2.0	An autoimmune multi-organ disease typically associated with vasculopathy and autoantibody production. Most patients have antinuclear antibodies (ANA). The presence of anti-dsDNA or anti-Smith antibodies are highly-specific.	ncit:C3201		
PD							Vitiligo	hl_v2.0	Generalized well circumscribed patches of leukoderma that are generally distributed over symmetric body locations and is due to autoimmune destruction of melanocytes.	ncit:C26915		
PD							Cleft Lip	hl_v2.0	A congenital abnormality consisting of one or more clefts (splits) in the upper lip, which may be accompanied by a cleft palate; it is the result of the failure of the embryonic parts of the lip to fuse.	ncit:C87175		
PD							Cleft Palate	hl_v2.0	A congenital abnormality consisting of a fissure in the midline of the hard and/or soft palate; it is the result of the failure of the two sides of the palate to fuse during embryonic development.	ncit:C87069		
PD							Clubfoot	hl_v2.0	The most common congenital deformation of the foot, occurring in 1 of 1,000 live births. The most common form is talipes equinovarus, where the deformed foot is turned downward and inward sharply.	ncit:C84641		
PD							Gastroschisis	hl_v2.0	A congenital birth defect characterized by the exposure of the fetal intestines outside the abdominal wall through an abdominal wall opening.	ncit:C84725		
PD							Heart Defect	hl_v2.0	Genetic anomalies and collections of malformations that are known to cluster together that can be associated with congenital heart defects.	ncit:C168217		
PD							Lynch Syndrome	hl_v2.0	An autosomal dominant hereditary neoplastic syndrome characterized by the development of colorectal carcinoma and a high risk of developing endometrial carcinoma, gastric carcinoma, ovarian carcinoma, renal pelvis carcinoma, and small intestinal carcinoma. Patients often develop colorectal carcinomas at an early age (mean, 45 years). In the majority of the cases the lesions arise from the proximal colon. At the molecular level, high-frequency microsatellite instability is present.	ncit:C8494		
PD							Mixed Connective Tissue Disease	hl_v2.0	An autoimmune overlap syndrome characterized by the presence of symptoms of systemic lupus erythematosus, systemic scleroderma, and polymyositis.	ncit:C84892		
PD							APC	nrsts_v2.0				
PD							Costello	nrsts_v2.0				
PD							DICER1	nrsts_v2.0				
PD							Li-Fraumeni	nrsts_v2.0				
PD							NF-1	nrsts_v2.0				
PD							RB1	nrsts_v2.0				
PD							Secondary Malignancy	nrsts_v2.0				
VD	CONDITION_STATUS	Enum	n/a	gct_v2.0			_undefined_	_undefined_	_undefined_	_undefined_		
PD							Present	gct_v2.0	Being or existing in a specified place or at the specified time.	ncit:C25626		
PD							Absent	gct_v2.0	Not existing in a specified place at a specified time.	ncit:C48190		
PD							Unknown	gct_v2.0	Reported as unknown by the data contributor.	ncit:C17998		
PD							Not Reported	gct_v2.0	Not provided or available.	ncit:C43234		
VD	CONDITION_CATEGORY	Enum	n/a	hl_v2.0	A classification of the medical history.	ncit:C83018	_undefined_	_undefined_	_undefined_	_undefined_		
PD							Genetic Syndrome	hl_v2.0	Genetic diseases are diseases in which inherited genes predispose to increased risk. The genetic disorders associated with cancer often result from an alteration or mutation in a single gene. The diseases range from rare dominant cancer family syndrome to familial tendencies in which low-penetrance genes may interact with other genes or environmental factors to induce cancer. Research may involve clinical, epidemiologic, and laboratory studies of persons, families, and populations at high risk of these disorders.	ncit:C3101		
PD							Autoimmune Disease	hl_v2.0	A disorder resulting from loss of function or tissue destruction of an organ or multiple organs, arising from humoral or cellular immune responses of the individual to his own tissue constituents. It may be systemic (e.g., systemic lupus erythematosus), or organ specific, (e.g., thyroiditis).	ncit:C2889		
PD							Congenital Anomaly	hl_v2.0	Any abnormality, anatomical or biochemical, evident at birth or during the neonatal period.	ncit:C2849		
PD							Unknown	hl_v2.0	Reported as unknown by the data contributor.	ncit:C17998		
PD							Not Reported	hl_v2.0	Not provided or available.	ncit:C43234		
VD	ASSISTED_CONCEPTION	Enum	n/a	hl_v2.0			_undefined_	_undefined_	_undefined_	_undefined_		
PD							In Vitro Fertilization	hl_v2.0	Fertilization of an ovum outside of the body.	ncit:C16580		
PD							Intracytoplasmic Sperm Injection	hl_v2.0	Injecting a single sperm into the center of an egg.	ncit:C185482		
PD							Other	hl_v2.0	Different than the one(s) previously specified or mentioned.	ncit:C17649		
PD							Unknown	hl_v2.0	Not known, observed, recorded; or reported as unknown by the data contributor.	ncit:C17998		
PD							Not Reported	hl_v2.0	Not provided or available.	ncit:C43234		
												
												
TD	Survival Characteristics											
TG	Refer to each data dictionary for specific table implementation guidance											
VD	HONEST_BROKER_SUBJECT_ID	String	n/a	aml_v2.0 | gct_v2.0 | hl_v2.0 | nbl_v2.0 | nrsts_v2.0 | rms_v2.0	The identifier assigned to the subject by the honest broker. An individual, organization or system acting for, or on behalf of, a covered entity to collect and provide health information to research investigators in such a manner whereby it would not be reasonably possible for the investigators or others to identify the corresponding patients-subjects directly or indirectly. The honest broker cannot be one of the investigators. The information provided to the investigators by the honest broker may incorporate linkage codes to permit information collation and/or subsequent inquiries (i.e., a "re-identification code"), however the information linking this re- identification code to the patient's identity must be retained by the honest broker and subsequent inquiries are conducted through the honest broker.	ncit:C168949	_undefined_	_undefined_	_undefined_	_undefined_		
VD	AGE_AT_LKSS	Integer	n/a	aml_v2.0 | gct_v2.0 | hl_v2.0 | nbl_v2.0 | nrsts_v2.0 | rms_v2.0	Age in Days at Last Known Survival Status	ncit:C168844	_undefined_	_undefined_	_undefined_	_undefined_		
VD	TIME_PERIOD_SUBMITTER_ID	String	n/a	aml_v2.0 | gct_v2.0 | hl_v2.0 | nbl_v2.0	This is the SUBMITTER_ID of the time period (defined in the "Time Period" table) during which this observation takes place.		_undefined_	_undefined_	_undefined_	_undefined_		
VD	LKSS	Enum	n/a	aml_v2.0 | gct_v2.0 | hl_v2.0 | nbl_v2.0 | nrsts_v2.0 | rms_v2.0	The individual's last known survival status.	ncit:C168931	_undefined_	_undefined_	_undefined_	_undefined_		
PD							Alive	aml_v2.0 | gct_v2.0 | hl_v2.0 | nbl_v2.0 | nrsts_v2.0 | rms_v2.0	Showing characteristics of life; displaying signs of life.	ncit:C37987		
PD							Dead	aml_v2.0 | gct_v2.0 | hl_v2.0 | nbl_v2.0 | nrsts_v2.0 | rms_v2.0	The cessation of life.	ncit:C28554		
PD							Unknown	aml_v2.0 | gct_v2.0 | hl_v2.0 | nrsts_v2.0 | rms_v2.0	Reported as unknown by the data contributor.	ncit:C17998		
VD	AGE_LOST_TO_FOLLOW_UP	Integer	n/a	aml_v2.0 | hl_v2.0	Age of subject (in days) when the subject was lost to follow-up.	ncit:C172679	_undefined_	_undefined_	_undefined_	_undefined_		
VD	CAUSE_OF_DEATH	Enum	n/a	aml_v2.0 | gct_v2.0 | hl_v2.0 | nbl_v2.0 | nrsts_v2.0 | rms_v2.0	The circumstance or condition that results in the death of a living being.	ncit:C81239	_undefined_	_undefined_	_undefined_	_undefined_		
PD							Disease Progression	aml_v2.0 | gct_v2.0 | hl_v2.0 | nbl_v2.0 | nrsts_v2.0 | rms_v2.0	An indication that the subject has died due to the progression of their disease.	ncit:C168970		
PD							Pre-Treatment Disease Complications	aml_v2.0 | hl_v2.0	A complication of the disease that existed prior to treatment.	ncit:C168876		
PD							Post-Treatment Disease Complications	aml_v2.0	A complication of the disease that occurred after treatment.	ncit:C168877		
PD							Treatment-Related Mortality	aml_v2.0 | gct_v2.0 | nbl_v2.0 | nrsts_v2.0 | rms_v2.0		ncit:C166165		
PD							Unrelated to Disease or Treatment	aml_v2.0	The cause of death of the subject is unrelated to the disease or treatment that was given.	ncit:C17649		
PD							Unknown	aml_v2.0 | gct_v2.0 | hl_v2.0 | rms_v2.0	Reported as unknown by the data contributor.	ncit:C17998		
PD							Not Reported	aml_v2.0 | gct_v2.0 | rms_v2.0	Not provided or available.	ncit:C43234		
PD							Secondary Malignancy	gct_v2.0 | hl_v2.0 | nrsts_v2.0 | rms_v2.0	A malignant neoplasm that arises from a pre-existing lower grade lesion, or as a result of a primary lesion that has spread to secondary sites, or due to a complication of a cancer treatment.	ncit:C4968		
PD							Other	gct_v2.0 | hl_v2.0 | nbl_v2.0 | nrsts_v2.0 | rms_v2.0		ncit:C17649		
PD							Treatment-Related mortality	hl_v2.0	A death that is considered to be causally linked to a treatment.	ncit:C166165		
VD	TRM_TYPE	Enum	n/a	aml_v2.0 | hl_v2.0	The type of treatment related to the mortality of the subject.	ncit:C173260	_undefined_	_undefined_	_undefined_	_undefined_		
PD							Stem Cell Transplant	aml_v2.0 | hl_v2.0	A therapeutic procedure that involves the transplantation of hematopoietic stem cells, either with the patient as their own donor or from a donor to a patient. This can be used for treatment of malignant and non-malignant diseases.	ncit:C15431		
PD							Immunotherapy	aml_v2.0	Therapy designed to induce changes in a patient's immune status in order to treat disease.	ncit:C15262		
PD							Chemotherapy	aml_v2.0	The use of synthetic or naturally-occurring chemicals for the treatment of diseases.	ncit:C15632		
PD							Other	aml_v2.0 | hl_v2.0	Different than the one(s) previously specified or mentioned.	ncit:C17649		
PD							Unknown	aml_v2.0	Reported as unknown by the data contributor.	ncit:C17998		
PD							Not Reported	aml_v2.0	Not provided or available.	ncit:C43234		
VD	CAUSE_OF_DEATH_DETAIL	Enum	n/a	aml_v2.0 | hl_v2.0	Specific details of the cause of death.	ncit:C168868	_undefined_	_undefined_	_undefined_	_undefined_		
PD							Hemorrhage	aml_v2.0 | hl_v2.0	In medicine, loss of blood from damaged blood vessels. A hemorrhage may be internal or external, and usually involves a lot of bleeding in a short time.	ncit:C26791		
PD							Cardiac Failure	aml_v2.0	Inability of the heart to pump blood at an adequate rate to meet tissue metabolic requirements. Clinical symptoms of heart failure include: unusual dyspnea on light exertion, recurrent dyspnea occurring in the supine position, fluid retention or rales, jugular venous distension, pulmonary edema on physical exam, or pulmonary edema on chest x-ray presumed to be cardiac dysfunction.	ncit:C50577		
PD							Bacterial Infection	aml_v2.0 | hl_v2.0	An acute infectious disorder that is caused by gram positive or gram negative bacteria; representative examples include pneumococcal, streptococcal, salmonella, and meningeal infections.	ncit:C2890		
PD							Viral Infection	aml_v2.0 | hl_v2.0	Any disease caused by a virus.	ncit:C3439		
