INFO	Title	PCDC Data Model										
PD							Partial Response	gct_v2.0 | hl_v2.0 | nrsts_v2.0 | rms_v2.0	A finding indicating that there is a decrease in the size and the extent of tissue involvement by a malignant tumor in a patient.	ncit:C18212 | ncit:C18058		
PD							Stable Disease	gct_v2.0 | hl_v2.0 | nrsts_v2.0 | rms_v2.0	Cancer that is neither decreasing nor increasing in extent or severity.	ncit:C18213		
PD							Progressive Disease	gct_v2.0 | hl_v2.0 | nrsts_v2.0 | rms_v2.0		ncit:C35571		
PD							Complete Response	gct_v2.0 | hl_v2.0 | nrsts_v2.0 | rms_v2.0	The disappearance of all signs of cancer in response to treatment.	ncit:C4870		
PD							Very Good Partial Response	hl_v2.0	Partial response with additional serum and urine M-protein reduction, but not meeting complete response.	ncit:C123618		
PD							Not Evaluable	nrsts_v2.0 | rms_v2.0				
VD	BM_PCT_BLASTS_AT_RESPONSE	Integer	n/a	aml_v2.0	The percent of cells that were blasts in the subject's bone marrow used to make the response assessment.	ncit:C168959	_undefined_	_undefined_	_undefined_	_undefined_		
VD	BM_ANALYSIS_METHOD_AT_RESPONSE	Enum	n/a	aml_v2.0	The modality used to determine the bone marrow percent blasts.	ncit:C168960	_undefined_	_undefined_	_undefined_	_undefined_		
PD							Morphology	aml_v2.0	A light microscopic finding that describes the cellular characteristics and architectural patterns of cell populations in a tissue sample.	ncit:C35867		
PD							Flow Cytometry	aml_v2.0	A technique for counting, examining and sorting microscopic particles suspended in a stream of fluid.	ncit:C16585		
PD							Other	aml_v2.0	Different than the one(s) previously specified or mentioned.	ncit:C17649		
PD							Unknown	aml_v2.0	Reported as unknown by the data contributor.	ncit:C17998		
PD							Not Reported	aml_v2.0	Not provided or available.	ncit:C43234		
VD	ANC_AT_RESPONSE	Integer	n/a	aml_v2.0	The absolute neutrophil count used to make the response assessment.	ncit:C168961	_undefined_	_undefined_	_undefined_	_undefined_		
VD	ANC_THRESHOLD_AT_RESPONSE	Enum	n/a	aml_v2.0	Subject exceeded an absolute neutrophil count threshold of >= 500 (ANC/mm3) at the time of the response assessment.	ncit:C168962	_undefined_	_undefined_	_undefined_	_undefined_		
PD							No	aml_v2.0	The non-affirmative response to a question.	ncit:C49487		
PD							Yes	aml_v2.0	The affirmative response to a question.	ncit:C49488		
PD							Unknown	aml_v2.0	Reported as unknown by the data contributor.	ncit:C17998		
PD							Not Reported	aml_v2.0	Not provided or available.	ncit:C43234		
VD	PLATELET_COUNT_AT_RESPONSE	Integer	n/a	aml_v2.0	The platelet count used to make the response assessment.	ncit:C168963	_undefined_	_undefined_	_undefined_	_undefined_		
VD	PLATELET_THRESHOLD_AT_RESPONSE	Enum	n/a	aml_v2.0	Subject exceeded a platelet count threshold of >=50,000 (platelets/mm3) at the time of the response assessment.	ncit:C168964	_undefined_	_undefined_	_undefined_	_undefined_		
PD							No	aml_v2.0	The non-affirmative response to a question.	ncit:C49487		
PD							Yes	aml_v2.0	The affirmative response to a question.	ncit:C49488		
PD							Unknown	aml_v2.0	Reported as unknown by the data contributor.	ncit:C17998		
PD							Not Reported	aml_v2.0	Not provided or available.	ncit:C43234		
VD	RESPONSE_METHOD	Enum	n/a	gct_v2.0 | hl_v2.0		ncit:C178148	_undefined_	_undefined_	_undefined_	_undefined_		
PD							Imaging	gct_v2.0	A substance present in or produced by a tumor or by the host, that can be used for differentiating neoplastic from normal tissue based on measurements in body fluids, secretions, cells, and/or tissues. Markers are used in diagnosis, staging and prognosis of cancer, provide an estimation of tumor burden, and serve for monitoring effects of therapy, detecting recurrence, localization of tumors, and screening in general populations.	ncit:C17220		
PD							Tumor Marker	gct_v2.0	Any technology or method that aids in the visualization of any biological process, cell, tissue or organ for use in screening, diagnosis, surgical procedures or therapy.	ncit:C17369		
PD							Pathology	gct_v2.0	The medical science, and specialty practice, concerned with all aspects of disease, but with special reference to the essential nature, causes, and development of abnormal conditions, as well as the structural and functional changes that result from the disease processes. Informally used to mean the result of such an examination.	ncit:C18189		
PD							Unknown	gct_v2.0	Reported as unknown by the data contributor.	ncit:C17998		
PD							Not Reported	gct_v2.0	Not provided or available.	ncit:C43234		
PD							PET	hl_v2.0	A technique for measuring the gamma radiation produced by collisions of electrons and positrons (anti-electrons) within living tissue. In positron emission tomography (PET), a subject is given a dose of a positron-emitting radionuclide attached to a metabolically active substance (for example, 2-fluoro-2-deoxy-D-glucose (FDG), which is similar to a naturally occurring sugar, glucose, with the addition of a radioactive fluorine atom). When living tissue containing the positron emitter is bombarded by electrons, gamma radiation produced by collisions of electrons and positrons is detected by a scanner, revealing in fine detail the tissue location of the metabolically-active substance administered.	ncit:C17007		
PD							Gallium	hl_v2.0	An element with atomic symbol Ga, atomic number 31, and atomic weight 69.7. A rare silvery (usually trivalent) metallic element; brittle at low temperatures but liquid above room temperature; occurs in trace amounts in bauxite and zinc ores.	ncit:C66798		
PD							CT	hl_v2.0	A method of examining structures within the body by scanning them with X rays and using a computer to construct a series of cross-sectional scans along a single axis.	ncit:C17204		
PD							PET-CT	hl_v2.0	An imaging technique that utilizes positron emission tomography and computed tomography in a single machine.	ncit:C103512		
PD							PET-MRI	hl_v2.0	An imaging technique that utilizes positron emission tomography and magnetic resonance imaging in a single machine.	ncit:C103514		
PD							MRI	hl_v2.0	Imaging that uses radiofrequency waves and a strong magnetic field rather than x-rays to provide detailed pictures of internal organs and tissues. The technique is valuable for the diagnosis of many pathologic conditions, including cancer, heart and vascular disease, stroke, and joint and musculoskeletal disorders.	ncit:C16809		
PD							X-ray	hl_v2.0	A radiographic procedure using the emission of x-rays to form an image of the structure penetrated by the radiation.	ncit:C38101		
PD							Bone Scan	hl_v2.0	A nuclear imaging method used to evaluate pathological bone metabolism.	ncit:C17646		
PD							Bone Marrow Biopsy	hl_v2.0	A biopsy involving the removal of a core tissue containing bone spicules and hematopoietic elements embedded in the marrow stroma. This procedure is done in the hip area mainly for the diagnosis and evaluation of neoplastic and non-neoplastic hematopoietic disorders (e.g. anemias, leukemias, lymphomas) and the evaluation of the spread of solid tumors (e.g. carcinomas, sarcomas) and lymphomas for therapeutic purposes.	ncit:C15193		
PD							Ultrasound	hl_v2.0	High frequency sound, generally with a frequency greater than 20,000 Hz.	ncit:C64384		
PD							Not Applicable	hl_v2.0	Determination of a value is not relevant in the current context.	ncit:C48660		
PD							Other	hl_v2.0	Different than the one(s) previously specified or mentioned.	ncit:C17649		
VD	RESPONSE_SYSTEM	Enum	n/a	gct_v2.0	A standard from which a judgment concerning tumor response to therapy can be established.	ncit:C125932	_undefined_	_undefined_	_undefined_	_undefined_		
PD							RECIST	gct_v2.0	Standard parameters to be used when documenting response of solid tumors to treatment; a set of published rules that define when cancer patients improve ("respond"), stay the same ("stable"), or worsen ("progression") during treatments. (from www.recist.com)	ncit:C49164		
PD							WHO	gct_v2.0	A United Nations agency established to coordinate international health activities and to help governments improve health services.	ncit:C75419		
PD							Choi	gct_v2.0	A composite set of criteria developed by Choi et al. using imaging techniques in the evaluation of gastrointestinal stromal tumors response to imatinib mesylate treatment. These criteria integrate changes in tumor size and tumor density.	ncit:C122394		
PD							mRECIST	gct_v2.0	Modified RECIST criteria for assessment of response in malignant pleural mesothelioma. (Byrne MJ, Nowak AK. Modified RECIST criteria for assessment of response in malignant pleural mesothelioma. Ann Oncol. 2004 Feb;15(2):257-60.)	ncit:C126031		
PD							PERCIST	gct_v2.0	From RECIST to PERCIST: Evolving considerations for PET response criteria in solid tumors. (Wahl RL, Jacene H, Kasamon Y, Lodge MA. From RECIST to PERCIST: Evolving considerations for PET response criteria in solid tumors. J Nucl Med. 2009 May;50 Suppl 1:122S-50S.)	ncit:C126039		
PD							Unknown	gct_v2.0	Reported as unknown by the data contributor.	ncit:17998		
PD							Not Reported	gct_v2.0	Not provided or available.	ncit:43234		
VD	RESPONSE_SYSTEM_VERSION	String	n/a	gct_v2.0	The version of the response criteria.	ncit:C175042	_undefined_	_undefined_	_undefined_	_undefined_		
VD	INTERIM_RESPONSE	Enum	n/a	hl_v2.0	An evaluation prior to the completion of therapy that the individual is responding to therapy.	ncit:C185657	_undefined_	_undefined_	_undefined_	_undefined_		
PD							Rapid Early Response (Adequate)	hl_v2.0	An evaluation prior to the completion of therapy that the individual is responding rapidly to therapy.	ncit:C185658		
PD							Slow Early Response (Inadequate)	hl_v2.0	An evaluation prior to the completion of therapy that the individual is responding slowly to therapy.	ncit:C185659		
PD							Progressive Disease	hl_v2.0	A clinical, pathologic, and/or molecular finding indicating that the course of a disease is worsening in terms of extent or severity.	ncit:C35571		
VD	PCT_CHANGE	Decimal	n/a	hl_v2.0	The percentage of change in a particular lesion.	ncit:C185497	_undefined_	_undefined_	_undefined_	_undefined_		
VD	SYMPTOMS	Enum	n/a	hl_v2.0	Exhibiting the symptoms of a particular disease.	ncit:C25269	_undefined_	_undefined_	_undefined_	_undefined_		
PD							Yes	hl_v2.0	The affirmative response to a question.	ncit:C49488		
PD							No	hl_v2.0	The non-affirmative response to a question.	ncit:C49487		
VD	PALPABLE_NODES	Enum	n/a	hl_v2.0	The lymph nodes are felt on palpation.	ncit:C185660	_undefined_	_undefined_	_undefined_	_undefined_		
PD							Yes	hl_v2.0	The affirmative response to a question.	ncit:C49488		
PD							No	hl_v2.0	The non-affirmative response to a question.	ncit:C49487		
VD	NODULAR_SPLENIC	Enum	n/a	hl_v2.0	A finding indicating that Hodgkin lymphoma has spread to the spleen focally and there is associated involvement of the hilar lymph nodes.	ncit:C185322	_undefined_	_undefined_	_undefined_	_undefined_		
PD							Yes	hl_v2.0	The affirmative response to a question.	ncit:C49488		
PD							No	hl_v2.0	The non-affirmative response to a question.	ncit:C49487		
VD	TX_PRIOR_RESPONSE	Code	n/a	nrsts_v2.0 | rms_v2.0	Treatment Type Prior to Response Assessment		_undefined_	_undefined_	_undefined_	_undefined_		
PD							Chemotherapy	nrsts_v2.0 | rms_v2.0				
PD							Chemoradiotherapy	nrsts_v2.0 | rms_v2.0				
VD	NECROSIS	Code	n/a	nrsts_v2.0	Tumor Necrosis		_undefined_	_undefined_	_undefined_	_undefined_		
PD							Score 0: No Necrosis	nrsts_v2.0				
PD							<50% Necrosis	nrsts_v2.0				
PD							>=50% Necrosis	nrsts_v2.0				
PD							Unknown	nrsts_v2.0				
VD	NECROSIS_PCT	Number	n/a	nrsts_v2.0	Tumor Necrosis (%)		_undefined_	_undefined_	_undefined_	_undefined_		
												
												
TD	Adverse Events											
TG	Refer to each data dictionary for specific table implementation guidance											
VD	HONEST_BROKER_SUBJECT_ID	String	n/a	aml_v2.0 | gct_v2.0 | hl_v2.0	The identifier assigned to the subject by the honest broker. An individual, organization or system acting for, or on behalf of, a covered entity to collect and provide health information to research investigators in such a manner whereby it would not be reasonably possible for the investigators or others to identify the corresponding patients-subjects directly or indirectly. The honest broker cannot be one of the investigators. The information provided to the investigators by the honest broker may incorporate linkage codes to permit information collation and/or subsequent inquiries (i.e., a "re-identification code"), however the information linking this re- identification code to the patient's identity must be retained by the honest broker and subsequent inquiries are conducted through the honest broker.	ncit:C168949	_undefined_	_undefined_	_undefined_	_undefined_		
VD	AGE_AT_AE	Integer	n/a	aml_v2.0 | gct_v2.0 | hl_v2.0	Age of subject (in days) at the onset of the adverse event.	ncit:C172677	_undefined_	_undefined_	_undefined_	_undefined_		
VD	AGE_AT_AE_RESOLVED	Integer	n/a	aml_v2.0 | hl_v2.0	The age (in days) of the subject when this adverse event was resolved.	ncit:C175043	_undefined_	_undefined_	_undefined_	_undefined_		
VD	TIME_PERIOD_SUBMITTER_ID	String	n/a	aml_v2.0 | gct_v2.0 | hl_v2.0	This is the SUBMITTER_ID of the time period (defined in the "Time Period" table) during which this observation takes place.		_undefined_	_undefined_	_undefined_	_undefined_		
VD	ADVERSE_EVENT	Enum	n/a	aml_v2.0 | gct_v2.0 | hl_v2.0	Any unfavorable or unintended disease, sign, or symptom (including an abnormal laboratory finding) that is temporally associated with the use of a medical treatment or procedure, and that may or may not be considered related to the medical treatment or procedure. Such events can be related to the intervention, dose, route of administration, patient, or caused by an interaction with another drug(s) or procedure(s).	ncit:C41331	_undefined_	_undefined_	_undefined_	_undefined_		
PD							Left Ventricular Systolic Dysfunction	aml_v2.0	The degree of impairment of the left cardiac ventricle to contract efficiently. (ACC)	ncit:C64251		
PD							Infection	aml_v2.0 | hl_v2.0	The invasion of an organism's body tissues by disease-causing agents and their multiplication, as well as the reaction by the host to these organisms and/or toxins that the organisms produce.	ncit:C128320		
PD							Sinusoidal Obstruction Syndrome	aml_v2.0	A disorder characterized by inflammation and damage of the hepatic sinusoidal endothelial cells of the hepatic venules that leads to venular occlusion and hepatocellular necrosis. It is most often a conditioning-related toxicity that results as a complication of hematopoietic stem cell transplantation (HSCT). It has also been described in populations of individuals who have ingested pyrrolizidine plant alkaloids. The clinical signs and symptoms include hyperbilirubinemia, hepatomegaly, and fluid retention.	ncit:C26793		
PD							Typhlitis	aml_v2.0	Inflammation of the cecum, usually accompanied by neutropenia.	ncit:C38043		
PD							Multi Organ Failure	aml_v2.0	Complete impairment of two or more organs or organ systems.	ncit:C75568		
PD							Hyperbilirubinemia	aml_v2.0	Abnormally high level of bilirubin in the blood. Excess bilirubin is associated with jaundice.	ncit:C27088		
PD							Hemorrhage	aml_v2.0	The flow of blood from a ruptured blood vessel.	ncit:C26791		
PD							Neurotoxicity Syndrome	aml_v2.0	A group of neurologic disorders caused by damage to the nervous system following exposure to pharmacologic, biologic, and chemical agents. Examples of neurotoxins include chemotherapy agents, radiation treatment, heavy metals, pesticides, and food additives.	ncit:C27961		
PD							Graft Versus Host Disease	aml_v2.0	A reaction, which may be fatal, in an immunocompromised subject (host) who has received an antigenically incompatible tissue transplant (graft) from an immunocompetent donor. The reaction is secondary to the activation of the transplanted cells against those host tissues that express an antigen not expressed by the donor, and is seen most commonly following bone marrow transplantation; acute disease is seen after 5-40 days, and chronic disease occurs weeks to months after transplantation.	ncit:C3063		
PD							Other	aml_v2.0 | gct_v2.0 | hl_v2.0	Different than the one(s) previously specified or mentioned.	ncit:C17649		
PD							Unknown	aml_v2.0 | gct_v2.0	Reported as unknown by the data contributor.	ncit:C17998		
PD							Not Reported	aml_v2.0 | gct_v2.0	Not provided or available.	ncit:C43234		
PD							Renal Toxicity	gct_v2.0 | hl_v2.0	Toxicity that impairs or damages the kidney. This condition is often caused by the administration of a pharmaceutical agent that causes damage to the kidney.	ncit:C115459		
PD							Neuropathy	gct_v2.0 | hl_v2.0	A disorder affecting the cranial nerves or the peripheral nervous system. It manifests with pain, tingling, numbness, and muscle weakness. It may be the result of physical injury, toxic substances, viral diseases, diabetes, renal failure, cancer, and drugs.	ncit:C4731		
PD							Pulmonary Toxicity	gct_v2.0 | hl_v2.0	Toxicity that impairs or damages the lung(s). This condition is often caused by the administration of a pharmaceutical agent that causes damage to the lungs.	ncit:C177374		
PD							Ototoxicity	gct_v2.0	Damage to the inner ear as a result of exposure to drugs or chemicals.	ncit:C66929		
PD							Allergic Reaction	hl_v2.0	An immune response that occurs following re-exposure to an innocuous antigen, and that requires the presence of existing antibodies against that antigen. This response involves the binding of IgE to mast cells, and may worsen with repeated exposures.	ncit:C114476		
PD							Mucositis	hl_v2.0	Inflammation of the mucous membranes.	ncit:C115965		
PD							Neutropenia	hl_v2.0	A decrease in the number of neutrophils in the peripheral blood.	ncit:C80520		
PD							Thrombocytopenia	hl_v2.0	A laboratory test result indicating that there is an abnormally small number of platelets in the circulating blood.	ncit:C3408		
PD							Hepatic Toxicity	hl_v2.0	Toxicity that impairs or damages the liver.	ncit:C185645		
PD							Cardiac Toxicity	hl_v2.0	Toxicity that impairs or damages the heart. This condition is often caused by the administration of a pharmaceutical agent that initiates a poisonous or toxic response in cardiac tissue.	ncit:C27994		
PD							GI Toxicity	hl_v2.0	Toxicity that impairs or damages the gastrointestinal system.	ncit:C185646		
PD							Rashes	hl_v2.0	Any change in the skin which affects its appearance or texture. A rash may be localized to one part of the body, or affect all the skin. Rashes may cause the skin to change color, itch, become warm, bumpy, dry, cracked or blistered, swell and may be painful.	ncit:C39594		
PD							Endocrine Toxicity	hl_v2.0	Indicates that a toxicity adverse effect has been experienced during endocrine drug treatment.	ncit:C138163		
PD							Musculoskeletal Toxicity	hl_v2.0	A toxicity that impairs or damages the musculoskeletal system.	ncit:C185647		
PD							Fatigue	hl_v2.0	Overall tiredness and lack of energy.	ncit:C3036		
PD							Psychiatric Toxicity	hl_v2.0	Toxicity that develops due to the administration of psychiatric medications.	ncit:C185648		
VD	AE_CODE	String	n/a	aml_v2.0 | hl_v2.0	The code of the adverse event.	ncit:C173313	_undefined_	_undefined_	_undefined_	_undefined_		
VD	AE_CODE_SYSTEM	Enum	n/a	aml_v2.0	The name of the system used to grade the adverse events.	ncit:C168872	_undefined_	_undefined_	_undefined_	_undefined_		
PD							SNOMED	aml_v2.0				
PD							ICD	aml_v2.0				
PD							European Society for Blood and Marrow Transplantation (EBMT)	aml_v2.0	A non-profit organization established in 1974 to allow scientists and physicians involved in clinical bone marrow transplantations to share experiences and develop co-operative studies.	ncit:C168842		
PD							CTCAE	aml_v2.0	A standard terminology developed to report adverse events occurring in cancer clinical trials. Common terminology criteria for adverse events (CTCAE) are used in study adverse event summaries and Investigational New Drug reports to the Food and Drug Administration. The CTCAE contain a grading scale for each adverse event term representing the severity of the event.	ncit:C49704		
PD							Unknown	aml_v2.0	Reported as unknown by the data contributor.	ncit:C17998		
PD							Not Reported	aml_v2.0	Not provided or available.	ncit:C43234		
VD	AE_SYSTEM_VERSION	String	n/a	aml_v2.0 | hl_v2.0	The version of the adverse event grading system.	ncit:C173314	_undefined_	_undefined_	_undefined_	_undefined_		
VD	GRADE	Enum	n/a	aml_v2.0 | gct_v2.0	A numeric value corresponding to the degree of severity of an adverse event.	ncit:C166200	_undefined_	_undefined_	_undefined_	_undefined_		
PD							Grade 1	aml_v2.0 | gct_v2.0	An experience that is usually transient, and requires no special treatment or intervention. The event does not generally interfere with usual daily activities. Includes transient laboratory test alterations.	ncit:C41338		
PD							Grade 2	aml_v2.0 | gct_v2.0	An experience that is alleviated with simple therapeutic treatments. The event impacts usual daily activities. Includes laboratory test alterations indicating injury, but without long-term risk.	ncit:C41339		
PD							Grade 3	aml_v2.0 | gct_v2.0	An adverse event experience that requires intensive therapeutic intervention and interrupts usual daily activities.	ncit:C41340		
PD							Grade 4	aml_v2.0 | gct_v2.0	An adverse event that has life-threatening consequences; for which urgent intervention is indicated; that puts the patient at risk of death at the time of the event if immediate intervention is not undertaken.	ncit:C84266		
PD							Grade 5	aml_v2.0 | gct_v2.0	The termination of life associated with an adverse event.	ncit:C48275		
PD							Unknown	aml_v2.0 | gct_v2.0	Reported as unknown by the data contributor.	ncit:C17998		
PD							Not Reported	aml_v2.0 | gct_v2.0	Not provided or available.	ncit:C43234		
VD	ATTRIBUTION	Enum	n/a	aml_v2.0 | gct_v2.0	A specific identifiable level (defined qualitatively or quantitatively) of probability of adverse event being caused or associated with the product or procedure administration to a patient.	ncit:C41358	_undefined_	_undefined_	_undefined_	_undefined_		
PD							Definite	aml_v2.0 | gct_v2.0	A characteristic used to qualify the adverse event as certainly related to the medical intervention. According to WHO causality assessment criteria of suspected adverse reactions it is applicable to a clinical event, including laboratory test abnormality, occurring in a plausible time relationship to medical intervention, and which cannot be explained by concurrent disease or other interventions. The response to withdrawal of the medical product (dechallenge) should be clinically plausible. The event must be definitive pharmacologically or phenomenologically, using a satisfactory rechallenge procedure if necessary.	ncit:C53260		
PD							Probable	aml_v2.0 | gct_v2.0	Probable adverse event relationship to study product or procedure is defined when there is a clear-cut temporal association between product or procedure administration and adverse event, and a potential alternative etiology of the event is not apparent.	ncit:C41357		
PD							Possible	aml_v2.0 | gct_v2.0	A characteristic indicating that an adverse event may be related to the medical intervention. According to WHO causality assessment criteria of suspected adverse reactions it is applicable to a clinical event, including laboratory test abnormality, with a reasonable time sequence to administration of the drug, but which could also be explained by concurrent disease or other drugs or chemicals. Information on drug withdrawal may be lacking or unclear.	ncit:C53258		
PD							Unlikely	aml_v2.0 | gct_v2.0	A characteristic used to qualify the adverse event as unlikely related to the medical intervention. According to WHO causality assessment criteria of suspected adverse reactions it is applicable to a clinical event, including laboratory test abnormality, with a temporal relationship to the medical intervention which makes a causal relationship improbable, and in which other interventions or underlying disease provide plausible explanations.	ncit:C53257		
PD							Unrelated	aml_v2.0 | gct_v2.0	A characteristic used to qualify the adverse event as clearly not related to the medical intervention.	ncit:C53256		
PD							Unknown	aml_v2.0 | gct_v2.0	Reported as unknown by the data contributor.	ncit:C17998		
PD							Not Reported	aml_v2.0 | gct_v2.0	Not provided or available.	ncit:C43234		
VD	OUTCOME	Enum	n/a	aml_v2.0 | gct_v2.0	A condition or event that is attributed to the adverse event and is the result or conclusion of the adverse event.	ncit:C49489	_undefined_	_undefined_	_undefined_	_undefined_		
PD							Death, Contributory	aml_v2.0 | gct_v2.0	Any adverse event contributing to the cause of death.	ncit:C168948		
PD							Death, Noncontributory	aml_v2.0 | gct_v2.0	The adverse event did not directly contribute to the death of the subject.	ncit:C173315		
PD							Not Recovered	aml_v2.0	One of the possible results of an adverse event outcome that indicates that the event has not improved or recuperated.	ncit:C49494		
PD							Recovered with Sequelae	aml_v2.0 | gct_v2.0	One of the possible results of an adverse event outcome where the subject recuperated but retained pathological conditions resulting from the prior disease or injury.	ncit:C49495		
PD							Recovered	aml_v2.0 | gct_v2.0	One of the possible results of an adverse event outcome that indicates that the event has improved or recuperated.	ncit:C49498		
PD							Unknown	aml_v2.0 | gct_v2.0	Reported as unknown by the data contributor.	ncit:C17998		
