INFO	Title	PCDC Data Model										
PD							Orbit	aml_v2.0 | rms_v2.0	The bony cavity of the skull which contains the eye, anterior portion of the optic nerve, ocular muscles and ocular adnexa. Seven bones contribute to the structure of the orbit: the frontal, maxillary, zygomatic, sphenoid, lacrimal, ethmoid, and palatine bones.	ncit:C12347		
PD							Skin	aml_v2.0 | hl_v2.0 | nbl_v2.0	An organ that constitutes the external surface of the body. It consists of the epidermis, dermis, and skin appendages.	ncit:C12470		
PD							Testes	aml_v2.0	Either of the paired male reproductive glands that produce the male germ cells and the male hormones.	ncit:C12412		
PD							Other	aml_v2.0 | nrsts_v2.0 | rms_v2.0	Different than the one(s) previously specified or mentioned.	ncit:C17649		
PD							Unknown	aml_v2.0 | gct_v2.0 | hl_v2.0 | nrsts_v2.0 | rms_v2.0	Reported as unknown by the data contributor.	ncit:C17998		
PD							Not Reported	aml_v2.0 | gct_v2.0 | hl_v2.0 | nrsts_v2.0 | rms_v2.0	Not provided or available.	ncit:C43234		
PD							Ascitic Fluid	gct_v2.0	The tissues that surround the organs that are present within the abdominal cavity. The abdominal wall tissue is composed of layers of fat, parietal peritoneum, fascia, and muscles.	ncit:C77608		
PD							Brain	gct_v2.0 | rms_v2.0	An organ that is next to an organ of interest.	ncit:C180347 | ncit:C12439		
PD							Cerebrospinal Fluid	gct_v2.0	A gliding joint between the distal ends of the tibia and fibula and the proximal end of the talus.	ncit:C32078		
PD							Frontal Cortex	gct_v2.0	A biospecimen of ascitic fluid.	ncit:C159203		
PD							Head and Neck	gct_v2.0	The underside concavity where the arm and the shoulder are joined.	ncit:C12674		
PD							Liver	gct_v2.0 | hl_v2.0 | nbl_v2.0 | nrsts_v2.0	A triangular-shaped organ located under the diaphragm in the right hypochondrium. It is the largest internal organ of the body, weighting up to 2 kg. Metabolism and bile secretion are its main functions. It is composed of cells which have the ability to regenerate.	ncit:C12366 | ncit:C12392		
PD							Lung	gct_v2.0 | hl_v2.0 | nbl_v2.0 | nrsts_v2.0 | rms_v2.0	One of a pair of viscera occupying the pulmonary cavities of the thorax, the organs of respiration in which aeration of the blood takes place. As a rule, the right lung is slightly larger than the left and is divided into three lobes (an upper, a middle, and a lower or basal), while the left has two lobes (an upper and a lower or basal). Each lung is irregularly conical in shape, presenting a blunt upper extremity (the apex), a concave base following the curve of the diaphragm, an outer convex surface (costal surface), an inner or mediastinal surface (mediastinal surface), a thin and sharp anterior border, and a thick and rounded posterior border.	ncit:C12439 | ncit:C12468		
PD							Mediastinum	gct_v2.0 | hl_v2.0	Either of the fleshy mounds in the rear pelvic area of the human body formed by the gluteal muscles.	ncit:C89806 | ncit:C12748		
PD							Occipital Cortex	gct_v2.0	The irregular and largest tarsal bone that forms the heel.	ncit:C32250		
PD							Peritoneum	gct_v2.0 | nrsts_v2.0	Any of the small bones of the wrist joint, located between the radius and the ulna and the metacarpus.	ncit:C12688 | ncit:C12770		
PD							Omentum	gct_v2.0	The fluid that is contained within the brain ventricles, the subarachnoid space and the central canal of the spinal cord.	ncit:C12692		
PD							Ovary	gct_v2.0 | rms_v2.0	Any one of the seven vertebrae that are caudal to the skull, denoted as C1, C2, C3, C4, C5, C6 or C7.	ncit:C12693 | ncit:C12404		
PD							Parietal Cortex	gct_v2.0	The lower part of the uterus occupying the region between the isthmus of the uterus and the vagina. It is divided into supravaginal and vaginal portions.	ncit:C12311		
PD							Pineal	gct_v2.0	The total system of structures outside the lungs that move as a part of breathing; it includes all structures from the skin to the parietal pleura.	ncit:C62484		
PD							Retroperitoneum	gct_v2.0 | nrsts_v2.0 | rms_v2.0	The back of the abdomen where the kidneys lie and the great blood vessels run.	ncit:C12298		
PD							Sacrococcygeal	gct_v2.0	One of a pair of bones linking the scapula and the sternum. The clavicle is part of the pectoral girdle.	ncit:C12695		
PD							Spinal Cord	gct_v2.0	The bones that form the head, made up of the bones of the braincase and face.	ncit:C12789		
PD							Spine	gct_v2.0	The inner layer of the two main layers of the skin. The dermis has connective tissue, blood vessels, oil and sweat glands, nerves, hair follicles, and other structures. It is made up of a thin upper layer called the papillary dermis, and a thick lower layer called the reticular dermis.	ncit:C12701		
PD							Suprasellar/Neurohypophyseal	gct_v2.0	A type of hinge joint located between the forearm and upper arm.	ncit:C32497		
PD							Temporal Cortex	gct_v2.0	The anterior portion of the head extending from the forehead to the chin and ear to ear. The facial structures contain the eyes, nose and mouth, cheeks and jaws.	ncit:C13071		
PD							Testis	gct_v2.0	The upper leg bone positioned between the pelvis and the knee.	ncit:C12717		
PD							Thalamus	gct_v2.0	The small, lateral calf bone extending from the knee to the ankle.	ncit:C12718		
PD							Vagina	gct_v2.0 | rms_v2.0	Any of the digits of the hand.	ncit:C32608 | ncit:C12407		
PD							Cervix Lymph Node	gct_v2.0	The structure found below the ankle joint required for locomotion.	ncit:C32622		
PD							Mediastinal Lymph Node	gct_v2.0	The structure on the upper limb, between the elbow and the wrist.	ncit:C32628		
PD							Omentum Lymph Node	gct_v2.0	The grey matter, or outermost layer of the frontal lobe.	ncit:C177766		
PD							Pelvic Lymph Node	gct_v2.0	The distal portion of the upper extremity. It consists of the carpus, metacarpus, and digits.	ncit:C32712		
PD							Retroperitoneum Lymph Node	gct_v2.0	For oncology, an area of the body generally construed to comprise the base of skull and facial bones, sinuses, orbits, salivary glands, oral cavity, oropharynx, larynx, thyroid, facial and neck musculature and lymph nodes draining these areas.	ncit:C12418		
PD							Lymph Node	gct_v2.0	The lateral prominence of the pelvis from the waist to the thigh.	ncit:C64193		
PD							Axillary Nodes	hl_v2.0	One of approximately 20-30 lymph nodes in chain formation that traverse the concavity of the underarm to the clavicle.	ncit:C12904		
PD							Axilla or Pectoral	hl_v2.0				
PD							Celiac Nodes	hl_v2.0	A lymph node at the base of the celiac artery.	ncit:C65166		
PD							Cervical Nodes	hl_v2.0	Any of the lymph nodes located in the neck.	ncit:C32298		
PD							Epitrochlear Nodes	hl_v2.0	A lymph node located above and adjacent to the elbow.	ncit:C98182		
PD							Hilar Nodes	hl_v2.0	A lymph node located in the area around the hilum of an organ.	ncit:C102330		
PD							Iliac	hl_v2.0				
PD							Iliac Crest	hl_v2.0	The broad, dorsal, upper, and widest of the three principal bones composing either half of the pelvis.	ncit:C32765		
PD							Infraclavicular Nodes	hl_v2.0	A lymph node located in the area below the clavicle.	ncit:C63705		
PD							Inguinal Nodes	hl_v2.0	A superficial or deep lymph node located in the inguinal area.	ncit:C32801		
PD							Inguinal or Femoral Nodes	hl_v2.0	A superficial or deep lymph node located in the inguinal area.	ncit:C32801		
PD							Mesenteric Nodes	hl_v2.0	A lymph node located in the mesentery.	ncit:C77641		
PD							Muscle	hl_v2.0				
PD							Paraaortic Lymph Node	hl_v2.0	A lymph node located adjacent to the lumbar region of the spine.	ncit:C77643		
PD							Pectoral Nodes	hl_v2.0	An axillary lymph node located along the lower edge of the pectoralis minor.	ncit:C120322		
PD							Pleura	hl_v2.0 | nrsts_v2.0	The tissue that lines the wall of the thoracic cavity and the surface of the lungs.	ncit:C12469		
PD							Popliteal Nodes	hl_v2.0	Lymph node located within the fat layer of the knee joint.	ncit:C53146		
PD							Preauricular Lymph Node	hl_v2.0	A lymph node located anterior to the auricle of the ear.	ncit:C103429		
PD							Spleen	hl_v2.0	An organ that is part of the hematopoietic and immune systems. It is composed of the white pulp and the red pulp and is surrounded by a capsule. It is located in the left hypochondriac region. Its functions include lymphocyte production, blood cell storage, and blood cell destruction.	ncit:C12432		
PD							Splenic Hilar Nodes	hl_v2.0	A lymph node located in the hilar region of the spleen.	ncit:C33600		
PD							Supraclavicular Nodes	hl_v2.0	A lymph node which is located above the clavicle.	ncit:C12903		
PD							Thyroid	hl_v2.0 | rms_v2.0	An endocrine gland located at the base of the neck that produces and secretes thyroxine and other hormones. Thyroxine is important for metabolic control.	ncit:C12400		
PD							Waldeyer's Ring	hl_v2.0	The ring of lymphoid tissue located in the pharynx, consisting of the pharyngeal, tubal, palatine, and lingual tonsils.	ncit:C73468		
PD							Distant Lymph Nodes	nbl_v2.0 | nrsts_v2.0 | rms_v2.0	A bean-shaped organ surrounded by a connective tissue capsule. It is part of the lymphatic system and is found throughout the body. It is composed predominantly of lymphocytes and its main function is immune protection.	ncit:C12745		
PD							Adrenal Gland	nbl_v2.0	A flattened, roughly triangular body resting upon the upper end of each kidney; it is one of the ductless glands furnishing internal secretions (epinephrine and norepinephrine from the medulla and steroid hormones from the cortex).	ncit:C12666		
PD							Abdomen	nbl_v2.0 | rms_v2.0	The cavity located between the lungs and pelvis. It contains the lower esophagus, stomach, pancreas, intestines, liver, gallbladder and spleen.	ncit:C12664		
PD							Neck	nbl_v2.0 | nrsts_v2.0 | rms_v2.0	The region that connects the head to the rest of the body.	ncit:C13063		
PD							Thorax	nbl_v2.0 | rms_v2.0	The division of the body lying between the neck and the abdomen.	ncit:C12799		
PD							Pelvis	nbl_v2.0 | nrsts_v2.0 | rms_v2.0	The bony, basin-shaped structure formed by the hipbones and the base of the backbone supporting the lower limbs in humans.	ncit:C12767		
PD							Abdominal Wall	nrsts_v2.0	The tissues that surround the organs that are present within the abdominal cavity. The abdominal wall tissue is composed of layers of fat, parietal peritoneum, fascia, and muscles.	ncit:C77608		
PD							Brain/Leptomeninges	nrsts_v2.0	An organ composed of grey and white matter containing billions of neurons that is the center for intelligence and reasoning. It is protected by the bony cranium. | The two innermost layers of tissue that cover the brain and spinal cord, the arachnoid mater and the pia mater.	ncit:C12439 | ncit:C32979		
PD							Breast	nrsts_v2.0	One of two hemispheric projections of variable size situated in the subcutaneous layer over the pectoralis major muscle on either side of the chest.	ncit:C12971		
PD							Chest Wall	nrsts_v2.0	The total system of structures outside the lungs that move as a part of breathing; it includes all structures from the skin to the parietal pleura.	ncit:C62484		
PD							Foot	nrsts_v2.0 | rms_v2.0	The structure found below the ankle joint required for locomotion.	ncit:C32622		
PD							Hand	nrsts_v2.0 | rms_v2.0	The distal portion of the upper extremity. It consists of the carpus, metacarpus, and digits.	ncit:C32712		
PD							Head	nrsts_v2.0	The anterior and superior part of a human bearing the mouth, the brain and sensory organs.	ncit:C12419		
PD							Hip	nrsts_v2.0	The lateral prominence of the pelvis from the waist to the thigh.	ncit:C64193		
PD							Intraperitoneal	nrsts_v2.0	Relating to the peritoneal cavity as the intended site of administration.	ncit:C13352		
PD							Intrathoracic	nrsts_v2.0	Within the thoracic cavity.	ncit:C105579		
PD							Leg	nrsts_v2.0 | rms_v2.0	The portion of the lower extremity between the knee and the ankle. For clinical purposes this term is also used to refer to the whole inferior limb.	ncit:C32974		
PD							Lower Arm	nrsts_v2.0	The lower arm, also known as the forearm, is the region of the upper limb (arm) that extends from the elbow joint to the wrist joint. It is positioned between the upper arm (which includes the upper arm bone, or humerus) and the hand. The lower arm is an essential part of the human upper extremity and plays a significant role in various daily activities, including lifting, gripping, and manipulating objects.			
PD							Paraspinal	nrsts_v2.0 | rms_v2.0	Pertaining to muscles and/or tissue adjacent to the spinal column.	ncit:C129461		
PD							Perineum	nrsts_v2.0 | rms_v2.0	The area located between the anus and vulva in females, and anus and scrotum in males.	ncit:C33301		
PD							Shoulder	nrsts_v2.0 | rms_v2.0	The region of the body between the neck and the upper arm.	ncit:C25203		
PD							Thigh	nrsts_v2.0 | rms_v2.0	A part of the lower limb, located between hip and knee.	ncit:C33763		
PD							Upper Arm	nrsts_v2.0 | rms_v2.0	The portion of the upper extremity between the shoulder and the elbow. For clinical purposes this term is also used to refer to the whole superior limb.	ncit:C32141		
PD							Urogenital	nrsts_v2.0	Of or related to the genital and urinary organs or their functions.	ncit:C25350		
PD							Anal/Perianal	rms_v2.0	The lower opening of the digestive tract, lying in the cleft between the buttocks, through which fecal matter is extruded. | The skin area around the anus.	ncit:C43362 | ncit:C99148		
PD							Bladder	rms_v2.0	The distensible sac-like organ that functions as a reservoir of urine, collecting from the kidneys and eliminating via the urethra.	ncit:C12414		
PD							Bladder/Prostate	rms_v2.0	The distensible sac-like organ that functions as a reservoir of urine, collecting from the kidneys and eliminating via the urethra. | The walnut shaped accessory sex gland of the male reproductive system. It is located in the pelvis just below the bladder, surrounding the prostatic part of the urethra. The prostate gland secretes a fluid which is part of the semen.	ncit:C12414 | ncit:C12410		
PD							Cervix	rms_v2.0	The lower part of the uterus occupying the region between the isthmus of the uterus and the vagina. It is divided into supravaginal and vaginal portions.	ncit:C12311		
PD							Cheek	rms_v2.0	The fleshy part of the face bounded by the eyes, nose, ear, and jaw line.	ncit:C13070		
PD							Eyelid	rms_v2.0	A thin membrane of skin with the purpose of covering and protecting an eye.	ncit:C12713		
PD							Forearm	rms_v2.0	The structure on the upper limb, between the elbow and the wrist.	ncit:C32628		
PD							Hypopharynx	rms_v2.0	The lower part of the pharynx that connects to the esophagus.	ncit:C12246		
PD							Infratemporal Fossa/Pterygopalatine	rms_v2.0	The infratemporal fossa, also known as the pterygopalatine fossa, is a complex anatomical region located in the human skull, specifically on the lateral aspect of the skull base. It is situated deep within the skull, adjacent to the maxillary (upper jaw) and sphenoid bones. This anatomical area is crucial in housing and providing passage for various important structures, including nerves, blood vessels, and muscles.			
PD							Kidney	rms_v2.0	One of the two bean-shaped organs located on each side of the spine in the retroperitoneum. The right kidney is located below the liver and the left kidney below the diaphragm. The kidneys filter and secrete metabolic products and minerals from the blood, thus maintaining homeostasis. On the superior pole of each kidney there is an adrenal gland. Each kidney and adrenal gland is surrounded by fat.	ncit:C12415		
PD							Knee	rms_v2.0	A joint connecting the lower part of the femur with the upper part of the tibia. The lower part of the femur and the upper part of the tibia are attached to each other by ligaments. Other structures of the knee joint include the upper part of the fibula, located below and parallel to the tibia, and the patella which moves as the knee bends.	ncit:C32898		
PD							Larynx	rms_v2.0	The cartilaginous structure of the respiratory tract between the pharynx and the trachea. It contains elastic vocal cords required for sound production.	ncit:C12420		
PD							Liver/Biliary Tract	rms_v2.0	A triangular-shaped organ located under the diaphragm in the right hypochondrium. It is the largest internal organ of the body, weighting up to 2 kg. Metabolism and bile secretion are its main functions. It is composed of cells which have the ability to regenerate. | The system that transports bile from the hepatocytes in the liver to the small intestine. It is comprised of the intrahepatic bile ducts, hepatic ducts, common bile duct, cystic duct, and the gallbladder.	ncit:C12392 | ncit:C12678		
PD							Lower Leg	rms_v2.0	The lower leg is the portion of the lower limb, also known as the leg, that extends from the knee joint down to the ankle joint. It is located between the upper leg (thigh) and the foot and is an essential anatomical structure that facilitates movement, weight-bearing, and locomotion.			
PD							Middle Ear	rms_v2.0	The part of the ear including the eardrum and ossicles. The middle ear leads to the inner ear.	ncit:C12274		
PD							Nasal Cavity	rms_v2.0	The proximal portion of the respiratory passages on either side of the nasal septum lying between the floor of the cranium and the roof of the mouth and extending from the face to the pharynx. The nasal cavity is lined with ciliated mucosa, extending from the nares to the pharynx.	ncit:C12424		
PD							Nasopharynx	rms_v2.0	The part of the pharynx in the back of the throat, at and above the soft palate. The nasopharynx is continuous with the nasal passages.	ncit:C12423		
PD							Oral Cavity	rms_v2.0	The cavity located at the upper end of the alimentary canal, behind the teeth and gums that is bounded on the outside by the lips, above by the hard and soft palates and below by the tongue.	ncit:C12421		
PD							Oropharynx	rms_v2.0	The part of the pharynx between the soft palate and the upper portion of the epiglottis.	ncit:C12762		
PD							Paranasal Sinuses	rms_v2.0	Any one of the air-filled spaces within the ethmoid, frontal, maxillary, or sphenoid bones, which communicate with the nasal cavity.	ncit:C12763		
PD							Parapharyngeal Area	rms_v2.0	A cone-shaped lateral neck space with its base on the base of the skull and its apex at the hyoid bone.	ncit:C162818		
PD							Paratesticular	rms_v2.0	A small anatomical compartment that contains the testicular collecting system, and mesothelial and mesenchymal components that represent extensions of the abdominal cavity and retroperitoneum.	ncit:C162491		
PD							Parathyroid	rms_v2.0				
PD							Parotid	rms_v2.0	The largest of the three paired salivary glands, located in front of the ear.	ncit:C12427		
PD							Pleural Effusion	rms_v2.0	Increased amounts of fluid within the pleural cavity. Symptoms include shortness of breath, cough, and chest pain. It is usually caused by lung infections, congestive heart failure, pleural and lung tumors, connective tissue disorders, and trauma.	ncit:C3331		
PD							Prostate	rms_v2.0	The walnut shaped accessory sex gland of the male reproductive system. It is located in the pelvis just below the bladder, surrounding the prostatic part of the urethra. The prostate gland secretes a fluid which is part of the semen.	ncit:C12410		
PD							Scalp	rms_v2.0	The skin which covers the top of the head and which is usually covered by hair.	ncit:C89807		
PD							Soft Tissue	rms_v2.0	A general term comprising tissue that is not hardened or calcified; including muscle, fat, blood vessels, nerves, tendons, ligaments and fascia.	ncit:C12471		
PD							Trunk	rms_v2.0	The body excluding the head and neck and limbs.	ncit:C33816		
PD							Uterus	rms_v2.0	A hollow, thick-walled, muscular organ located within the pelvic cavity of a woman. Within the uterus the fertilized egg implants and the fetus develops during pregnancy.	ncit:C12405		
PD							Vulva	rms_v2.0	The external, visible part of the female genitalia surrounding the urethral and vaginal opening. The vulva includes the clitoris and inner as well as outer labia.	ncit:C12408		
VD	AGE_AT_DISEASE_SITE_ASSESSMENT	Integer	n/a	gct_v2.0 | hl_v2.0 | nbl_v2.0 | nrsts_v2.0 | rms_v2.0	The age (in days) of the subject at the time of this disease site assessment.	ncit:C174997	_undefined_	_undefined_	_undefined_	_undefined_		
VD	TUMOR_SUBMITTER_ID	String	n/a	gct_v2.0	The anatomic site of the tumor.		_undefined_	_undefined_	_undefined_	_undefined_		
VD	PRIMARY_TUMOR_SUBMITTER_ID	String	n/a	gct_v2.0	The reference ID of the primary tumor - this ties non-primary tumors back to their appropriate primary tumor.		_undefined_	_undefined_	_undefined_	_undefined_		
VD	CLASSIFICATION	Enum	n/a	gct_v2.0 | hl_v2.0 | nbl_v2.0 | nrsts_v2.0 | rms_v2.0	The classification of a tumor based primarily on histopathological characteristics.	ncit:C174459	_undefined_	_undefined_	_undefined_	_undefined_		
PD							Primary	gct_v2.0 | hl_v2.0 | nbl_v2.0 | nrsts_v2.0 | rms_v2.0	A tumor at the original site of origin.	ncit:C8509		
PD							Metastatic	gct_v2.0 | hl_v2.0 | nbl_v2.0 | nrsts_v2.0 | rms_v2.0	A term referring to the clinical or pathologic observation of a tumor extension from its original site of growth to another anatomic site.	ncit:C14174		
PD							Regional	gct_v2.0 | rms_v2.0		ncit:C41844		
PD							Unknown	gct_v2.0 | nbl_v2.0 | rms_v2.0	Reported as unknown by the data contributor.	ncit:C17998		
PD							Not Reported	gct_v2.0 | nbl_v2.0 | rms_v2.0	Not provided or available.	ncit:C43234		
VD	STATE	Enum	n/a	gct_v2.0	The status of the tumor classification whether it was completed or not.		_undefined_	_undefined_	_undefined_	_undefined_		
PD							Present	gct_v2.0	Being or existing in a specified place or at the specified time.	ncit:C25626		
PD							Absent	gct_v2.0	Not existing in a specified place at a specified time.	ncit:C48190		
PD							Not Evaluated	gct_v2.0	Not all target lesions were assessed. Or not all non-target lesions were assessed.	ncit:C103424		
VD	LATERALITY	Enum	n/a	gct_v2.0 | hl_v2.0	A qualifier for the side of the body the tumor findings assessment is performed.	ncit:C119931	_undefined_	_undefined_	_undefined_	_undefined_		
PD							Left	gct_v2.0 | hl_v2.0	A finding indicating the tumor location is on the left side of the specimen.	ncit:C160200		
PD							Right	gct_v2.0 | hl_v2.0	A finding indicating the tumor location is on the right side of the specimen.	ncit:C160199		
PD							Bilateral	gct_v2.0 | hl_v2.0	A finding indicating the tumor location is on the both sides of the specimen.	ncit:C160201		
PD							Midline	gct_v2.0 | hl_v2.0	A finding indicating the tumor location is on the midline of the specimen.	ncit:C162614		
PD							Unknown	gct_v2.0	Reported as unknown by the data contributor.	ncit:C17998		
PD							Not Reported	gct_v2.0	Not provided or available.	ncit:C43234		
VD	REVIEW_SOURCE	Enum	n/a	hl_v2.0	The type of assessment that was used to review.	ncit:C185324	_undefined_	_undefined_	_undefined_	_undefined_		
PD							Central	hl_v2.0	Review by a single person or group of laboratory test results, protocols, or other data generated from multiple locations.	ncit:C191951		
PD							Institutional	hl_v2.0	Local institutional review process at treating institution.	ncit:C185325		
VD	E_EXTENSION_SITE	Enum	n/a	hl_v2.0	The anatomic location outside of the lymph nodes into which a disease lesion has directly spread.	ncit:C185478	_undefined_	_undefined_	_undefined_	_undefined_		
PD							Chest Wall	hl_v2.0	The total system of structures outside the lungs that move as a part of breathing; it includes all structures from the skin to the parietal pleura.	ncit:C62484		
PD							Heart	hl_v2.0	A hollow organ located slightly to the left of the middle portion of the chest. It is composed of muscle and it is divided by a septum into two sides: the right side which receives de-oxygenated blood from the body and the left side which sends newly oxygenated blood to the body. Each side is composed of two chambers: the atrium (receiving blood) and ventricle (ejecting blood).	ncit:C12727		
PD							Lungs	hl_v2.0	One of a pair of viscera occupying the pulmonary cavities of the thorax, the organs of respiration in which aeration of the blood takes place. As a rule, the right lung is slightly larger than the left and is divided into three lobes (an upper, a middle, and a lower or basal), while the left has two lobes (an upper and a lower or basal). Each lung is irregularly conical in shape, presenting a blunt upper extremity (the apex), a concave base following the curve of the diaphragm, an outer convex surface (costal surface), an inner or mediastinal surface (mediastinal surface), a thin and sharp anterior border, and a thick and rounded posterior border.	ncit:C12468		
PD							Soft Tissue	hl_v2.0	A general term comprising tissue that is not hardened or calcified; including muscle, fat, blood vessels, nerves, tendons, ligaments and fascia.	ncit:C12471		
PD							Bone	hl_v2.0	The structural organ comprised of specialized connective tissue that forms the skeletal components of the body.	ncit:C12366		
PD							Other	hl_v2.0	Different than the one(s) previously specified or mentioned.	ncit:C17649		
VD	DIAMETER1	Decimal	n/a	hl_v2.0 | nrsts_v2.0 | rms_v2.0	The longest diameter of the tumor.	ncit:C96684	_undefined_	_undefined_	_undefined_	_undefined_		
VD	DIAMETER1_UNIT	Enum	n/a	hl_v2.0 | nrsts_v2.0 | rms_v2.0	The unit of measure symbol associated with a biospecimen or tissue fragment dimension.		_undefined_	_undefined_	_undefined_	_undefined_		
PD							cm	hl_v2.0 | nrsts_v2.0 | rms_v2.0	A basic unit of length in the former CGS version of metric system, equal to one hundredth of a meter or approximately 0.393 700 787 inch.	ncit:C49668		
