PD						Not Reported	Not provided or available.	ncit:C43234		
VD	PELVIC_INVOLVEMENT	Code	Optional	An query about the involved area of the pelvis.	ncit:C186711	_undefined_	_undefined_	_undefined_		
PD						External Hemipelvectomy	Unilateral removal of the pelvic girdle by resection of the innominate bone plus amputation of the ipsilateral limb.	ncit:C175014		
PD						Internal Hemipelvectomy	Unilateral removal of the pelvic girdle by resecting the innominate bone while preserving the ipsilateral limb.	ncit:C175013		
PD						Unknown	Reported as unknown by the data contributor.	ncit:C17998		
PD						Not Reported	Not provided or available.	ncit:C43234		
VD	INTERNAL_HEMI_SITE	Code	Optional	The area involved in the internal hemipelvectomy.	ncit:C186706	_undefined_	_undefined_	_undefined_		
PD						Ilium	The broad, dorsal, upper, and widest of the three principal bones composing either half of the pelvis.	ncit:C32765		
PD						Para-Acetabulum	The area around the acetabulum.	ncit:C186705		
PD						Ischium	The most posterior and ventral bone making up the pelvis.	ncit:C32884		
PD						Sacrum	The triangular bone, made up of 5 fused bones of the spine, located in the lower area of the spine between the fifth lumbar vertebra and the coccyx.	ncit:C33508		
VD	EXTERNAL_HEMI_SITE	Code	Optional	The site where the external hemipelvectomy was performed.	ncit:C186709	_undefined_	_undefined_	_undefined_		
PD						Ilium	The broad, dorsal, upper, and widest of the three principal bones composing either half of the pelvis.	ncit:C32765		
PD						Para-Acetabulum	The area around the acetabulum.	ncit:C186705		
PD						Ischium	The most posterior and ventral bone making up the pelvis.	ncit:C32884		
PD						Sacrum	The triangular bone, made up of 5 fused bones of the spine, located in the lower area of the spine between the fifth lumbar vertebra and the coccyx.	ncit:C33508		
VD	BIOPSY_TYPE	Code	Optional	The removal of tissue specimens or fluid from the living body for microscopic examination, performed to establish a diagnosis.	ncit:C15189	_undefined_	_undefined_	_undefined_		
PD						Core Needle	The removal of a tissue sample using a needle with a relatively large diameter, for microscopic examination.	ncit:C15680		
PD						Incisional Biopsy	A surgical procedure in which part of a lesion is removed for microscopic examination.	ncit:C15386		
PD						Excisional Biopsy	A surgical procedure in which an entire lesion is removed for microscopic examination.	ncit:C15385		
PD						Other	Different than the one(s) previously specified or mentioned.	ncit:C17649		
PD						Unknown	Reported as unknown by the data contributor.	ncit:C17998		
PD						Not Reported	Not provided or available.	ncit:C43234		
VD	MET_NON_LUNG_MGMT	Code	Optional	Surgical treatment of metastatic disease not involving the lungs.	ncit:C175028	_undefined_	_undefined_	_undefined_		
PD						No	The non-affirmative response to a question.	ncit:C49487		
PD						Yes	The affirmative response to a question.	ncit:C49488		
PD						Unknown	Reported as unknown by the data contributor.	ncit:C17998		
PD						Not Reported	Not provided or available.	ncit:C43234		
VD	MET_LUNG_MGMT	Code	Optional	Surgical treatment of disease metastatic to the lungs.	ncit:C175029	_undefined_	_undefined_	_undefined_		
PD						Thoracotomy	A surgical procedure in which an large incision is made into the chest wall, for the purpose of accessing organs inside the thoracic cavity.	ncit:C15337		
PD						Sternotomy	Incision into or through the sternum.	ncit:C25220		
PD						Video-Assisted Thoroscopic Surgery	Thoracic surgery that is aided by the use of a video camera.	ncit:C63704		
PD						Pneumonectomy	A lymph node located in the area below the clavicle.	ncit:C63705		
PD						Lobectomy	Surgical removal of a lobe of an organ.	ncit:C15272		
PD						Wedge Resection	Surgical removal of a triangular wedge shaped section of tissue.	ncit:C51690		
PD						Other	Different than the one(s) previously specified or mentioned.	ncit:C17649		
PD						Unknown	Reported as unknown by the data contributor.	ncit:C17998		
PD						Not Reported	Not provided or available.	ncit:C43234		
VD	INTRAOP_ADJUVANT	Code	Optional	An additional therapy administered during surgery.	ncit:C186694	_undefined_	_undefined_	_undefined_		
PD						Navigation and Robotics	A surgical technique that uses a specially designed robotic system to aid with the surgical procedure.	ncit:C140885		
PD						Indocyanine Green (ICG) Fluorescence Angiography	A diagnostic imaging procedure to examine blood flow and associated pathology using intravenous indocyanine green dye.	ncit:C175030		
PD						Methylene Blue Dye Marking	The use of methylene blue, a commonly used stain to enhance tissue specimens viewed under a microscope.	ncit:C175031		
PD						Wire Localization	A procedure involving the use of a wire for the localization of a usually non-palpable breast lesion that needs to be surgically removed.	ncit:C91832		
PD						Other	Different than the one(s) previously specified or mentioned.	ncit:C17649		
PD						Unknown	Reported as unknown by the data contributor.	ncit:C17998		
PD						Not Reported	Not provided or available.	ncit:C43234		
VD	TUMOR_FROM_MARGIN	Number	Optional	The distance of the closest surgical margin from tumor after surgical resection of the tumor. The closest distance between a tumor and its resection margin has prognostic significance.	ncit:C137815	_undefined_	_undefined_	_undefined_		
										
										
DD	Treatment									
TD	Radiation Therapy									
TG	One row per subject per site of radiation therapy									
VD	AGE_AT_RT_START	Number	Mandatory	Age of subject (in days) at the start of radiation therapy.	ncit:C172695	_undefined_	_undefined_	_undefined_		
VD	AGE_AT_RT_END	Number	Mandatory	Age of subject (in days) at the end of radiation therapy.	ncit:C172696	_undefined_	_undefined_	_undefined_		
VD	DISEASE_PHASE	Code	Mandatory	The stage or period of an individual's disease.	ncit:C168878	_undefined_	_undefined_	_undefined_		
PD						Initial Diagnosis	The first diagnosis of the individual's condition.	ncit:C156813		
PD						Relapse	The return of a disease after a period of remission.	ncit:C38155		
PD						Progression	The worsening of a disease over time.	ncit:C17747		
PD						Relapse/Progression	Either the return of the disease or the progression of the disease.	ncit:C174991		
VD	DISEASE_PHASE_NUMBER	Number	Mandatory	The number of the disease phase.	ncit:C173258	_undefined_	_undefined_	_undefined_		
VD	COURSE	Code	Mandatory	The type of protocol treatment course administered.	ncit:C168807	_undefined_	_undefined_	_undefined_		
PD						Induction	The first choice of treatment for a particular type of cancer.	ncit:C158876		
PD						Consolidation	Treatment that is given after initial therapy to kill any remaining cancer cells.	ncit:C15679		
PD						Maintenance	Continuation of treatment for an extended period of time to prevent relapse.	ncit:C15688		
VD	COURSE_NUMBER	Number	Mandatory	The number assigned to a course of therapeutic agent administration, indicating where a particular course of treatment falls within a sequence of treatments.	ncit:C166235	_undefined_	_undefined_	_undefined_		
VD	TUMOR_CLASSIFICATION	Code	Optional	The classification of a tumor based primarily on histopathological characteristics.	ncit:C174459	_undefined_	_undefined_	_undefined_		
PD						Primary Tumor	A tumor at the original site of origin.	ncit:C8509		
PD						Metastatic	A tumor that has spread from its original (primary) site of growth to another site, close to or distant from the primary site. Metastasis is characteristic of advanced malignancies, but in rare instances can be seen in neoplasms lacking malignant morphology.	ncit:C3261		
PD						Unknown	Reported as unknown by the data contributor.	ncit:C17998		
PD						Not Reported	Not provided or available.	ncit:C43234		
VD	TUMOR_TISSUE_TYPE	Code	Optional	The type of material sample taken from a biological entity for tumor findings assessment testing.	ncit:C119940	_undefined_	_undefined_	_undefined_		
PD						Bone	Connective tissue that forms the skeletal components of the body.	ncit:C12366		
PD						Soft Tissue	A general term comprising tissue that is not hardened or calcified; including muscle, fat, blood vessels, nerves, tendons, ligaments and fascia.	ncit:C12471		
PD						Unknown	Reported as unknown by the data contributor.	ncit:C17998		
PD						Not Reported	Not provided or available.	ncit:C43234		
VD	RT_SITE	Code	Optional	The anatomic site of the radiation therapy.	ncit:C173281	_undefined_	_undefined_	_undefined_		
PD						Abdominal Wall	The upper leg bone positioned between the pelvis and the knee.	ncit:C12717		
PD						Adrenal	A bone located between the femur and the tarsus, being part of the lower leg.	ncit:C12800		
PD						Ankle	The small, lateral calf bone extending from the knee to the ankle.	ncit:C12718		
PD						Ankle Joint	A gliding joint between the distal ends of the tibia and fibula and the proximal end of the talus.	ncit:C32078		
PD						Anterior Skull Base	The portion of the skull that is formed laterally by the orbital plates of the frontal bone, medially by the cribriform palate and crista galli of the ethmoid bone, and posteriorly by the planum sphenoidale and lesser wings of the sphenoid bone.	ncit:C180372		
PD						Anus	The lower opening of the digestive tract, lying in the cleft between the buttocks, through which fecal matter is extruded.	ncit:C43362		
PD						Appendix	Small tissue projection existing as a cecal diverticulum with a questionable history of vestigial versus specialized organ.	ncit:C12380		
PD						Axilla	One of a pair of bones linking the scapula and the sternum. The clavicle is part of the pectoral girdle.	ncit:C12695		
PD						Basin	A regional collection of lymph nodes that drains lymph from a specific area of the body.	ncit:C94547		
PD						Bladder	The distensible sac-like organ that functions as a reservoir of urine, collecting from the kidneys and eliminating via the urethra.	ncit:C12414		
PD						Bone Face	Any bone that contributes to the facial structures, except those bones that are part of the braincase.	ncit:C63706		
PD						Bone Foot	One of the seven tarsal, five metatarsal, or 14 phalangeal bones in the foot.	ncit:C13068		
PD						Bone Shoulder Girdle	The bony arch formed by the collarbones and shoulder blades.	ncit:C33547		
PD						Brain	An organ composed of grey and white matter containing billions of neurons that is the center for intelligence and reasoning. It is protected by the bony cranium.	ncit:C12439		
PD						Breast	One of two hemispheric projections of variable size situated in the subcutaneous layer over the pectoralis major muscle on either side of the chest.	ncit:C12971		
PD						Bronchus	Tubular structure in continuation with the trachea, serving as air passage. It terminates in the lung (terminal bronchiole).	ncit:C12683		
PD						Buttock	Either of the fleshy mounds in the rear pelvic area of the human body formed by the gluteal muscles.	ncit:C89806		
PD						Carpal	A joint between the distal end of the radius and the proximal row of carpal bones.	ncit:C33894		
PD						Cervical Spine	The set of vertebrae immediately caudal to the skull.	ncit:C69313		
PD						Chest Wall	The total system of structures outside the lungs that move as a part of breathing; it includes all structures from the skin to the parietal pleura.	ncit:C62484		
PD						Clavicle	One of a pair of bones linking the scapula and the sternum. The clavicle is part of the pectoral girdle.	ncit:C12695		
PD						Coccyx	A small bone located at the bottom of the spine. The coccyx is a result of 3-5 fused rudimentary vertebrae.	ncit:C12696		
PD						Colon	The part of the large intestine measured from the cecum to the rectum consisting of ascending, transverse, descending and sigmoid portions. The purpose of the colon is to remove water from digested food prior to excretion.	ncit:C12382		
PD						Cutaneous	Having to do with the skin.	ncit:C13316		
PD						Deep Facial Areas	The anterior portion of the head extending from the forehead to the chin and ear to ear. The facial structures contain the eyes, nose and mouth, cheeks and jaws.	ncit:C13071		
PD						Dorsal Spine	A spinal curve that originates at the middle of the second thoracic vertebra and terminates at the middle of the last thoracic vertebra.	ncit:C32472		
PD						Duodenum	A jointed tube 25-30 cm long that connects the stomach to the jejunum.	ncit:C12263		
PD						Nasopharynx	The part of the pharynx in the back of the throat, at and above the soft palate. The nasopharynx is continuous with the nasal passages.	ncit:C12423		
PD						Elbow	A type of hinge joint located between the forearm and upper arm.	ncit:C32497		
PD						Elbow Joint	A type of hinge joint located between the forearm and upper arm.	ncit:C32497		
PD						Epididymis	A crescent-like structure located in the upper and posterior surfaces of the testis. It consists of the efferent ductules and the duct of the epididymis. It facilitates the maturation of sperm that is produced in the testis.	ncit:C12328		
PD						Esophagus	The portion of the digestive canal between the pharynx and stomach. It is about 25 cm long and consists of three parts: the cervical part, from the cricoid cartilage to the thoracic inlet; thoracic part, from thoracic inlet to the diaphragm; and abdominal part, below the diaphragm to the cardiac opening of the stomach.	ncit:C12389		
PD						Ethmoid	A light and spongy bone that is cubical in shape. This bone is positioned at the anterior part of the cranium, sitting between the two orbits, at the roof of the nose. It consists of four parts: a horizontal or cribriform plate; a perpendicular plate; and two lateral masses or labyrinths.	ncit:C12711		
PD						Fallopian Tube	One of a pair of tubes that extend from the uterus to each of the ovaries. Following ovulation the egg travels down the fallopian tube to the uterus where fertilization may or may not occur.	ncit:C12403		
PD						Femur	The upper leg bone positioned between the pelvis and the knee.	ncit:C12717		
PD						Fibula	The small, lateral calf bone extending from the knee to the ankle.	ncit:C12718		
PD						Finger	Any of the digits of the hand.	ncit:C32608		
PD						Foot	The structure found below the ankle joint required for locomotion.	ncit:C32622		
PD						Foot Bone	One of the seven tarsal, five metatarsal, or 14 phalangeal bones in the foot.	ncit:C13068		
PD						Foot Phalanges	A bone of the foot.	ncit:C52772		
PD						Forearm	The structure on the upper limb, between the elbow and the wrist.	ncit:C32628		
PD						Gallbladder	A pear-shaped organ located under the liver that stores and concentrates bile secreted by the liver. From the gallbladder the bile is delivered through the bile ducts into the intestine thereby aiding the digestion of fat-containing foods.	ncit:C12377		
PD						Gastrointestinal Tract	The upper gastrointestinal (GI) tract is comprised of mouth, pharynx, esophagus and stomach while the lower GI tract consists of intestines and anus. The primary function of the GI tract is to ingest, digest, absorb and ultimately excrete food stuff.	ncit:C34082		
PD						Groin	The lower region of the anterior abdominal wall located laterally to the pubic region.	ncit:C12726		
PD						Gynecological Area	Any component of the female organs and tissues involved in the production and maturation of gametes and in their union and subsequent development as offspring.	ncit:C13039		
PD						Hand	The distal portion of the upper extremity. It consists of the carpus, metacarpus, and digits.	ncit:C32712		
PD						Hand Bone	A bone of the hand.	ncit:C52771		
PD						Hand Phalanges	The hinge synovial joints between the phalanges of the fingers.	ncit:C32868		
PD						Head and Neck	For oncology, an area of the body generally construed to comprise the base of skull and facial bones, sinuses, orbits, salivary glands, oral cavity, oropharynx, larynx, thyroid, facial and neck musculature and lymph nodes draining these areas.	ncit:C12418		
PD						Heart	A hollow organ located slightly to the left of the middle portion of the chest. It is composed of muscle and it is divided by a septum into two sides: the right side which receives de-oxygenated blood from the body and the left side which sends newly oxygenated blood to the body. Each side is composed of two chambers: the atrium (receiving blood) and ventricle (ejecting blood).	ncit:C12727		
PD						Humerus	The upper arm bone between the shoulder and elbow.	ncit:C12731		
PD						Inferior Limb	A bone of the leg (lower extremity).	ncit:C12982		
PD						Kidney	One of the two bean-shaped organs located on each side of the spine in the retroperitoneum. The right kidney is located below the liver and the left kidney below the diaphragm. The kidneys filter and secrete metabolic products and minerals from the blood, thus maintaining homeostasis. On the superior pole of each kidney there is an adrenal gland. Each kidney and adrenal gland is surrounded by fat.	ncit:C12415		
PD						Knee	A joint connecting the lower part of the femur with the upper part of the tibia. The lower part of the femur and the upper part of the tibia are attached to each other by ligaments. Other structures of the knee joint include the upper part of the fibula, located below and parallel to the tibia, and the patella which moves as the knee bends.	ncit:C32898		
PD						Knee Joint	A joint connecting the lower part of the femur with the upper part of the tibia. The lower part of the femur and the upper part of the tibia are attached to each other by ligaments. Other structures of the knee joint include the upper part of the fibula, located below and parallel to the tibia, and the patella which moves as the knee bends.	ncit:C32898		
PD						Large Vessels	Any of the major arteries or veins attached to the cardiac atria or ventricles. This includes the aorta, superior and inferior vena cava and the pulmonary arteries and veins.	ncit:C102955		
PD						Larynx	The cartilaginous structure of the respiratory tract between the pharynx and the trachea. It contains elastic vocal cords required for sound production.	ncit:C12420		
PD						Trachea	The fibrocartilaginous, mucous-lined tube passing from the larynx to the bronchi.	ncit:C12428		
PD						Leg	The portion of the lower extremity between the knee and the ankle. For clinical purposes this term is also used to refer to the whole inferior limb.	ncit:C32974		
PD						Liver	A triangular-shaped organ located under the diaphragm in the right hypochondrium. It is the largest internal organ of the body, weighting up to 2 kg. Metabolism and bile secretion are its main functions. It is composed of cells which have the ability to regenerate.	ncit:C12392		
PD						Lower Limb	The limb that is composed of the hip, thigh, leg and foot.	ncit:C12742		
PD						Lumbar Spine	Those vertebrae between the ribs and the pelvis, L1-L5 in man.	ncit:C69314		
PD						Lung	One of a pair of viscera occupying the pulmonary cavities of the thorax, the organs of respiration in which aeration of the blood takes place. As a rule, the right lung is slightly larger than the left and is divided into three lobes (an upper, a middle, and a lower or basal), while the left has two lobes (an upper and a lower or basal). Each lung is irregularly conical in shape, presenting a blunt upper extremity (the apex), a concave base following the curve of the diaphragm, an outer convex surface (costal surface), an inner or mediastinal surface (mediastinal surface), a thin and sharp anterior border, and a thick and rounded posterior border.	ncit:C12468		
PD						Lymph Nodes	A bean-shaped organ surrounded by a connective tissue capsule. It is part of the lymphatic system and is found throughout the body. It is composed predominantly of lymphocytes and its main function is immune protection.	ncit:C12745		
PD						Mandible	The lower jaw bone holding the lower teeth.	ncit:C12290		
PD						Maxilla	The upper jawbone in vertebrates; it is fused to the cranium.	ncit:C26470		
PD						Meninges	Any one of three membranes that surround the brain and spinal cord.	ncit:C12348		
PD						Metacarpals	Any of the five bones between the wrist and the fingers that form the skeleton of the palm.	ncit:C12751		
PD						Metatarsals	A bone belonging to the middle part of the foot located between toes and ankle. There are 5 metatarsal bones and they are numbered from the medial side.	ncit:C12752		
PD						Nasal Septum	The thin wall between the two nasal cavities.	ncit:C33160		
PD						Neck	The region that connects the head to the rest of the body.	ncit:C13063		
PD						Oral Cavity	The cavity located at the upper end of the alimentary canal, behind the teeth and gums that is bounded on the outside by the lips, above by the hard and soft palates and below by the tongue.	ncit:C12421		
PD						Orbit	The bony cavity of the skull which contains the eye, anterior portion of the optic nerve, ocular muscles and ocular adnexa. Seven bones contribute to the structure of the orbit: the frontal, maxillary, zygomatic, sphenoid, lacrimal, ethmoid, and palatine bones.	ncit:C12347		
PD						Ovary	One of the paired female reproductive glands containing the ova or germ cells; the ovary's stroma is a vascular connective tissue containing numbers of ovarian follicles enclosing the ova.	ncit:C12404		
PD						Pancreas	An organ behind the lower part of the stomach that is the shape of a fish and about the size of a hand. It is a compound gland composed of both exocrine and endocrine tissues. The endocrine pancreas makes insulin so that the body can use glucose (sugar) for energy. The exocrine pancreas makes enzymes that help the body digest food. Spread all over the pancreas are areas called the Islets of Langerhans. The cells in these areas each have a special purpose. The alpha cells make glucagon, which raises the level of glucose in the blood; the beta cells make insulin; the delta cells make somatostatin. There are also PP cells and D1 cells, about which little is known.	ncit:C12393		
PD						Paratesticular	A small anatomical compartment that contains the testicular collecting system, and mesothelial and mesenchymal components that represent extensions of the abdominal cavity and retroperitoneum.	ncit:C162491		
PD						Patella	A small flat triangular bone in front of the knee that articulates with the femur and protects the knee joint.	ncit:C33282		
PD						Pelvis	The bony, basin-shaped structure formed by the hipbones and the base of the backbone supporting the lower limbs in humans.	ncit:C12767		
PD						Sacrum	The triangular bone, made up of 5 fused bones of the spine, located in the lower area of the spine between the fifth lumbar vertebra and the coccyx.	ncit:C33508		
PD						Penis	The male organ of urination and copulation.	ncit:C12409		
PD						Peritoneum	The tissue that lines the wall of the abdominal cavity, intestine, mesentery, and pelvic organs. It consists of the parietal peritoneum and the visceral peritoneum.	ncit:C12770		
PD						Pleura	The tissue that lines the wall of the thoracic cavity and the surface of the lungs.	ncit:C12469		
PD						Pleural	The tissue that lines the wall of the thoracic cavity and the surface of the lungs.	ncit:C12469		
PD						Prostate	The walnut shaped accessory sex gland of the male reproductive system. It is located in the pelvis just below the bladder, surrounding the prostatic part of the urethra. The prostate gland secretes a fluid which is part of the semen.	ncit:C12410		
PD						Radius	The long bone of the forearm that extends from the lateral aspect of the elbow to the thumb-side of the wrist.	ncit:C12777		
PD						Rectum	The terminal portion of the gastrointestinal tract, extending from the rectosigmoid junction to the anal canal.	ncit:C12390		
PD						Retroperitoneum	The back of the abdomen where the kidneys lie and the great blood vessels run.	ncit:C12298		
PD						Rib	Any one of the paired bones, 12 on either side, extending from the thoracic vertebrae toward the median line on the ventral aspect of the trunk. The long curved bones which form the rib cage. Generally, ribs 1 to 7 are connected to the sternum by their costal cartilages and are called true ribs, whereas ribs 8 to 12 are termed false ribs.	ncit:C12782		
PD						Sacrum	The triangular bone, made up of 5 fused bones of the spine, located in the lower area of the spine between the fifth lumbar vertebra and the coccyx.	ncit:C33508		
PD						Salivary Gland	An exocrine gland that secretes saliva. Salivary glands are mostly located in and around the oral cavity.	ncit:C12426		
PD						Scapula	The flat triangle-shaped bone that connects the humerus with the clavicle in the back of the shoulder.	ncit:C12783		
PD						Clavicle	One of a pair of bones linking the scapula and the sternum. The clavicle is part of the pectoral girdle.	ncit:C12695		
PD						Shoulder Girdle	The bony arch formed by the collarbones and shoulder blades.	ncit:C33547		
PD						Shoulder Joint	A ball-and-socket joint at the upper end of the humerus, located at the junction of humerus and scapula.	ncit:C33548		
PD						Paranasal Fossa	Any one of the air-filled spaces within the ethmoid, frontal, maxillary, or sphenoid bones, which communicate with the nasal cavity.	ncit:C12763		
PD						Skull	The bones that form the head, made up of the bones of the braincase and face.	ncit:C12789		
PD						Skull and Face Bone	The section of the intestines between the pylorus and cecum. The small intestine is approximately 20 feet long and consists of the duodenum, the jejunum, and the ileum. Its main function is to absorb nutrients from food as the food is transported to the large intestine.	ncit:C12386		
