PD						Fallopian Tube	One of a pair of tubes that extend from the uterus to each of the ovaries. Following ovulation the egg travels down the fallopian tube to the uterus where fertilization may or may not occur.	ncit:C12403		
PD						Female Reproductive System Part	Any component of the female organs and tissues involved in the production and maturation of gametes and in their union and subsequent development as offspring.	ncit:C13039		
PD						Femur	The upper leg bone positioned between the pelvis and the knee.	ncit:C12717		
PD						Fibula	The small, lateral calf bone extending from the knee to the ankle.	ncit:C12718		
PD						Finger	Any of the digits of the hand.	ncit:C32608		
PD						Foot	The structure found below the ankle joint required for locomotion.	ncit:C32622		
PD						Foot Bone	The structure found below the ankle joint required for locomotion.	ncit:C32622		
PD						Foot Phalanges	A bone of the foot.	ncit:C52772		
PD						Forearm	The structure on the upper limb, between the elbow and the wrist.	ncit:C32628		
PD						Gallbladder	A pear-shaped organ located under the liver that stores and concentrates bile secreted by the liver. From the gallbladder the bile is delivered through the bile ducts into the intestine thereby aiding the digestion of fat-containing foods.	ncit:C12377		
PD						Gastrointestinal Tract	The upper gastrointestinal (GI) tract is comprised of mouth, pharynx, esophagus and stomach while the lower GI tract consists of intestines and anus. The primary function of the GI tract is to ingest, digest, absorb and ultimately excrete food stuff.	ncit:C34082		
PD						Great Blood Vessels	Any of the major arteries or veins attached to the cardiac atria or ventricles. This includes the aorta, superior and inferior vena cava and the pulmonary arteries and veins.	ncit:C102955		
PD						Groin	The lower region of the anterior abdominal wall located laterally to the pubic region.	ncit:C12726		
PD						Hand	The distal portion of the upper extremity. It consists of the carpus, metacarpus, and digits.	ncit:C32712		
PD						Hand Bone	A bone of the hand.	ncit:C52771		
PD						Hand Phalanges	The hinge synovial joints between the phalanges of the fingers.	ncit:C32868		
PD						Head and Neck	For oncology, an area of the body generally construed to comprise the base of skull and facial bones, sinuses, orbits, salivary glands, oral cavity, oropharynx, larynx, thyroid, facial and neck musculature and lymph nodes draining these areas.	ncit:C12418		
PD						Heart	A hollow organ located slightly to the left of the middle portion of the chest. It is composed of muscle and it is divided by a septum into two sides: the right side which receives de-oxygenated blood from the body and the left side which sends newly oxygenated blood to the body. Each side is composed of two chambers: the atrium (receiving blood) and ventricle (ejecting blood).	ncit:C12727		
PD						Humerus	The upper arm bone between the shoulder and elbow.	ncit:C12731		
PD						Inferior Limb	A bone of the leg (lower extremity).	ncit:C12982		
PD						Kidney	One of the two bean-shaped organs located on each side of the spine in the retroperitoneum. The right kidney is located below the liver and the left kidney below the diaphragm. The kidneys filter and secrete metabolic products and minerals from the blood, thus maintaining homeostasis. On the superior pole of each kidney there is an adrenal gland. Each kidney and adrenal gland is surrounded by fat.	ncit:C12415		
PD						Knee	A joint connecting the lower part of the femur with the upper part of the tibia. The lower part of the femur and the upper part of the tibia are attached to each other by ligaments. Other structures of the knee joint include the upper part of the fibula, located below and parallel to the tibia, and the patella which moves as the knee bends.	ncit:C32898		
PD						Knee Joint	A joint connecting the lower part of the femur with the upper part of the tibia. The lower part of the femur and the upper part of the tibia are attached to each other by ligaments. Other structures of the knee joint include the upper part of the fibula, located below and parallel to the tibia, and the patella which moves as the knee bends.	ncit:C32898		
PD						Larynx	The cartilaginous structure of the respiratory tract between the pharynx and the trachea. It contains elastic vocal cords required for sound production.	ncit:C12420		
PD						Leg	The portion of the lower extremity between the knee and the ankle. For clinical purposes this term is also used to refer to the whole inferior limb.	ncit:C32974		
PD						Liver	A triangular-shaped organ located under the diaphragm in the right hypochondrium. It is the largest internal organ of the body, weighting up to 2 kg. Metabolism and bile secretion are its main functions. It is composed of cells which have the ability to regenerate.	ncit:C12392		
PD						Lower Limb	The limb that is composed of the hip, thigh, leg and foot.	ncit:C12742		
PD						Lumbar Spine	Those vertebrae between the ribs and the pelvis, L1-L5 in man.	ncit:C69314		
PD						Lung	One of a pair of viscera occupying the pulmonary cavities of the thorax, the organs of respiration in which aeration of the blood takes place. As a rule, the right lung is slightly larger than the left and is divided into three lobes (an upper, a middle, and a lower or basal), while the left has two lobes (an upper and a lower or basal). Each lung is irregularly conical in shape, presenting a blunt upper extremity (the apex), a concave base following the curve of the diaphragm, an outer convex surface (costal surface), an inner or mediastinal surface (mediastinal surface), a thin and sharp anterior border, and a thick and rounded posterior border.	ncit:C12468		
PD						Lymph Nodes	A bean-shaped organ surrounded by a connective tissue capsule. It is part of the lymphatic system and is found throughout the body. It is composed predominantly of lymphocytes and its main function is immune protection.	ncit:C12745		
PD						Lymphatic Basin	A regional collection of lymph nodes that drains lymph from a specific area of the body.	ncit:C94547		
PD						Mandible	The lower jaw bone holding the lower teeth.	ncit:C12290		
PD						Maxilla	The upper jawbone in vertebrates; it is fused to the cranium.	ncit:C26470		
PD						Meninges	Any one of three membranes that surround the brain and spinal cord.	ncit:C12348		
PD						Metacarpals	Any of the five bones between the wrist and the fingers that form the skeleton of the palm.	ncit:C12751		
PD						Metatarsals	A bone belonging to the middle part of the foot located between toes and ankle. There are 5 metatarsal bones and they are numbered from the medial side.	ncit:C12752		
PD						Nasal Septum	The thin wall between the two nasal cavities.	ncit:C33160		
PD						Nasopharynx	The part of the pharynx in the back of the throat, at and above the soft palate. The nasopharynx is continuous with the nasal passages.	ncit:C12423		
PD						Neck	The region that connects the head to the rest of the body.	ncit:C13063		
PD						Oral Cavity	The cavity located at the upper end of the alimentary canal, behind the teeth and gums that is bounded on the outside by the lips, above by the hard and soft palates and below by the tongue.	ncit:C12421		
PD						Orbit	The bony cavity of the skull which contains the eye, anterior portion of the optic nerve, ocular muscles and ocular adnexa. Seven bones contribute to the structure of the orbit: the frontal, maxillary, zygomatic, sphenoid, lacrimal, ethmoid, and palatine bones.	ncit:C12347		
PD						Ovary	One of the paired female reproductive glands containing the ova or germ cells; the ovary's stroma is a vascular connective tissue containing numbers of ovarian follicles enclosing the ova.	ncit:C12404		
PD						Pancreas	An organ behind the lower part of the stomach that is the shape of a fish and about the size of a hand. It is a compound gland composed of both exocrine and endocrine tissues. The endocrine pancreas makes insulin so that the body can use glucose (sugar) for energy. The exocrine pancreas makes enzymes that help the body digest food. Spread all over the pancreas are areas called the Islets of Langerhans. The cells in these areas each have a special purpose. The alpha cells make glucagon, which raises the level of glucose in the blood; the beta cells make insulin; the delta cells make somatostatin. There are also PP cells and D1 cells, about which little is known.	ncit:C12393		
PD						Paratesticular	A small anatomical compartment that contains the testicular collecting system, and mesothelial and mesenchymal components that represent extensions of the abdominal cavity and retroperitoneum.	ncit:C162491		
PD						Patella	A small flat triangular bone in front of the knee that articulates with the femur and protects the knee joint.	ncit:C33282		
PD						Pelvis	The bony, basin-shaped structure formed by the hipbones and the base of the backbone supporting the lower limbs in humans.	ncit:C12767		
PD						Penis	The male organ of urination and copulation.	ncit:C12409		
PD						Peritoneum	The tissue that lines the wall of the abdominal cavity, intestine, mesentery, and pelvic organs. It consists of the parietal peritoneum and the visceral peritoneum.	ncit:C12770		
PD						Pleura	The tissue that lines the wall of the thoracic cavity and the surface of the lungs.	ncit:C12469		
PD						Prostate	The walnut shaped accessory sex gland of the male reproductive system. It is located in the pelvis just below the bladder, surrounding the prostatic part of the urethra. The prostate gland secretes a fluid which is part of the semen.	ncit:C12410		
PD						Radius	The long bone of the forearm that extends from the lateral aspect of the elbow to the thumb-side of the wrist.	ncit:C12777		
PD						Rectum	The terminal portion of the gastrointestinal tract, extending from the rectosigmoid junction to the anal canal.	ncit:C12390		
PD						Retroperitoneum	The back of the abdomen where the kidneys lie and the great blood vessels run.	ncit:C12298		
PD						Rib	Any one of the paired bones, 12 on either side, extending from the thoracic vertebrae toward the median line on the ventral aspect of the trunk. The long curved bones which form the rib cage. Generally, ribs 1 to 7 are connected to the sternum by their costal cartilages and are called true ribs, whereas ribs 8 to 12 are termed false ribs.	ncit:C12782		
PD						Sacrum	The triangular bone, made up of 5 fused bones of the spine, located in the lower area of the spine between the fifth lumbar vertebra and the coccyx.	ncit:C33508		
PD						Salivary Gland	An exocrine gland that secretes saliva. Salivary glands are mostly located in and around the oral cavity.	ncit:C12426		
PD						Scalp	The skin which covers the top of the head and which is usually covered by hair.	ncit:C89807		
PD						Scapula	The flat triangle-shaped bone that connects the humerus with the clavicle in the back of the shoulder.	ncit:C12744		
PD						Shoulder Girdle	The bony arch formed by the collarbones and shoulder blades.	ncit:C33547		
PD						Shoulder Joint	A ball-and-socket joint at the upper end of the humerus, located at the junction of humerus and scapula.	ncit:C33548		
PD						Paranasal Sinus	Any one of the air-filled spaces within the ethmoid, frontal, maxillary, or sphenoid bones, which communicate with the nasal cavity.	ncit:C12763		
PD						Skull	The bones that form the head, made up of the bones of the braincase and face.	ncit:C12789		
PD						Small Intestine	The section of the intestines between the pylorus and cecum. The small intestine is approximately 20 feet long and consists of the duodenum, the jejunum, and the ileum. Its main function is to absorb nutrients from food as the food is transported to the large intestine.	ncit:C12386		
PD						Spine	A series of bones, muscles, tendons, and other tissues reaching from the base of the skull to the tailbone. The vertebral column forms the axis of the skeleton and encloses as well as protects the spinal cord and the fluid surrounding the spinal cord.	ncit:C12998		
PD						Spleen	An organ that is part of the hematopoietic and immune systems. It is composed of the white pulp and the red pulp and is surrounded by a capsule. It is located in the left hypochondriac region. Its functions include lymphocyte production, blood cell storage, and blood cell destruction.	ncit:C12432		
PD						Sternum	The long, flat bone connecting with the cartilages of the first seven ribs and the clavicle.	ncit:C62484		
PD						Stomach	An organ located under the diaphragm, between the liver and the spleen as well as between the esophagus and the small intestine. The stomach is the primary organ of food digestion.	ncit:C12391		
PD						Superior Maxilla	The facial bone that forms the mediala floor of the orbit.	ncit:C33682		
PD						Tarsals	Any one of the seven bones forming the instep of the foot.	ncit:C12796		
PD						Temporal Bone	A large irregular bone situated at the base and side of the skull, connected with the mandible via the temporomandibular joint. The temporal bone consists of the squamous, tympanic and petrous parts. The petrous portion of the temporal bone contains the vestibulocochlear organ of the inner ear.	ncit:C12797		
PD						Testis	Either of the paired male reproductive glands that produce the male germ cells and the male hormones.	ncit:C12412		
PD						Thigh	A part of the lower limb, located between hip and knee.	ncit:C33763		
PD						Thorax	The division of the body lying between the neck and the abdomen.	ncit:C12799		
PD						Thymus	A bi-lobed organ surrounded by a connective tissue capsule. It is located in the upper anterior portion of the chest, behind the sternum. It is composed predominantly of lymphocytes and fewer epithelial cells. Connective tissue septa separate the lobes into lobules. The lobules contain an outer portion (cortical zone) which is rich in lymphocytes and an inner portion (medullary zone) which is rich in epithelial cells. It is an organ essential for the development of the immune system. Its function is the maturation of the progenitor lymphoid cells to thymocytes and subsequently to mature T-cells. It reaches its greatest weight at puberty and subsequently begins to involute.	ncit:C12433		
PD						Thyroid	An endocrine gland located at the base of the neck that produces and secretes thyroxine and other hormones. Thyroxine is important for metabolic control.	ncit:C12400		
PD						Tibia	A bone located between the femur and the tarsus, being part of the lower leg.	ncit:C12800		
PD						Toe	One of the terminal digits of the foot.	ncit:C33788		
PD						Tonsil	The two organs situated in the throat on either side of the narrow passage from the mouth to the pharynx. They are composed of lymphoid tissues.	ncit:C12802		
PD						Trachea	The fibrocartilaginous, mucous-lined tube passing from the larynx to the bronchi.	ncit:C12428		
PD						Ulna	One of the bones that comprise the forearm. The largest aspect articulates with the humerus at the elbow joint and the smallest portion of the ulna articulates with the carpal bones in the wrist.	ncit:C12809		
PD						Upper Airway	The sinuses and those parts of the respiratory system above the trachea. It includes the nares, nasopharynx, oropharynx, larynx, vocal cords, glottis and upper trachea.	ncit:C33839		
PD						Upper Arm	The portion of the upper extremity between the shoulder and the elbow. For clinical purposes this term is also used to refer to the whole superior limb.	ncit:C32141		
PD						Upper Limb	The region of the body that includes the arm, the forearm, and hand.	ncit:C12671		
PD						Ureter	The thick-walled tube that carries urine from each kidney to the bladder.	ncit:C12416		
PD						Uterus	A hollow, thick-walled, muscular organ located within the pelvic cavity of a woman. Within the uterus the fertilized egg implants and the fetus develops during pregnancy.	ncit:C12405		
PD						Vagina	The female genital canal, extending from the uterus to the vulva.	ncit:C12407		
PD						Viscera	Two or more internal organs.	ncit:C28287		
PD						Vulva	The external, visible part of the female genitalia surrounding the urethral and vaginal opening. The vulva includes the clitoris and inner as well as outer labia.	ncit:C12408		
PD						Wrist	A joint between the distal end of the radius and the proximal row of carpal bones.	ncit:C33894		
PD						Wrist Joint	A joint between the distal end of the radius and the proximal row of carpal bones.	ncit:C33894		
PD						Other	Different than the one(s) previously specified or mentioned.	ncit:C17649		
PD						Unknown	Reported as unknown by the data contributor.	ncit:C17998		
PD						Not Reported	Not provided or available.	ncit:C43234		
PD						Wrist Joint	A joint between the distal end of the radius and the proximal row of carpal bones.	ncit:C33894		
PD						Other	Different than the one(s) previously specified or mentioned.	ncit:C17649		
PD						Unknown	Reported as unknown by the data contributor.	ncit:C17998		
PD						Not Reported	Not provided or available.	ncit:C43234		
VD	PROCEDURE_LATERALITY	Code	Optional	Dominant use or manifestations of one side of the body versus the other; referring to a side of the body or of a structure.	ncit:C25185	_undefined_	_undefined_	_undefined_		
PD						Left	Being or located on or directed toward the side of the body to the west when facing north.	ncit:C25229		
PD						Right	Being or located on or directed toward the side of the body to the east when facing north.	ncit:C25228		
PD						Bilateral	Affecting both sides of the body or a matched pair of organs.	ncit:C13332		
PD						Midline	A medial line, especially the medial line or medial plane of the body (or some part of the body).	ncit:C81170		
PD						Unknown	Reported as unknown by the data contributor.	ncit:C17998		
PD						Not Reported	Not provided or available.	ncit:C43234		
VD	PROCEDURE_TYPE	Code	Optional	A categorization of surgical procedures by type or purpose.	ncit:C161601	_undefined_	_undefined_	_undefined_		
PD						Surgery	A diagnostic or treatment procedure performed by manual and/or instrumental means, often involving an incision and the removal or replacement of a diseased organ or tissue; of or relating to or involving or used in surgery or requiring or amenable to treatment by surgery.	ncit:C15329		
PD						Biopsy	The removal of tissue specimens or fluid from the living body for microscopic examination, performed to establish a diagnosis.	ncit:C15189		
PD						Other	Different than the one(s) previously specified or mentioned.	ncit:C17649		
PD						Unknown	Reported as unknown by the data contributor.	ncit:C17998		
PD						Not Reported	Not provided or available.	ncit:C43234		
VD	SURGERY_TYPE_LIMB	Code	Optional	Surgical procedures on a limb.	ncit:C175009	_undefined_	_undefined_	_undefined_		
PD						Amputation	The surgical removal of all or part of a limb or other appendage.	ncit:C15179		
PD						Limb-Salvage	A procedure to avoid amputation of an arm or leg.	ncit:C16042		
PD						Excision	The surgical removal of a lesion, often as part of a biopsy and with healthy margins.	ncit:C15232		
PD						Wide Resection	Surgery to cut out the cancer and some healthy tissue around it.	ncit:C94441		
PD						Other	Different than the one(s) previously specified or mentioned.	ncit:C17649		
PD						Unknown	Reported as unknown by the data contributor.	ncit:C17998		
PD						Not Reported	Not provided or available.	ncit:C43234		
VD	AMPUTATION_TYPE	Code	Optional	The surgical removal of all or part of a limb or other appendage.	ncit:C15179	_undefined_	_undefined_	_undefined_		
PD						Disarticulation	The surgical separation of bones at a joint.	ncit:C175012		
PD						Rotationplasty	A surgical procedure used to treat malignant bone tumors near the knee in which the bottom of the femur and the upper tibia are surgically removed and the lower leg is rotated 180 degrees and re-attached to the femur. The foot and ankle then function as a substitute knee joint allowing for comparable stability to a below-the-knee amputation when placed in a prosthetic.	ncit:C180346		
PD						Amputation - Through Involved Bone	An amputation through the diseased portion of the bone.	ncit:C175010		
PD						Amputation - Proximal to Involved Bone	An amputation from the nearest feasible anatomical point to the involved portion of the bone.	ncit:C175011		
PD						Internal Hemipelvectomy	Unilateral removal of the pelvic girdle by resecting the innominate bone while preserving the ipsilateral limb.	ncit:C175013		
PD						External Hemipelvectomy	Unilateral removal of the pelvic girdle by resection of the innominate bone plus amputation of the ipsilateral limb.	ncit:C175014		
PD						Unknown	Reported as unknown by the data contributor.	ncit:C17998		
PD						Not Reported	Not provided or available.	ncit:C43234		
VD	RESECTION_TYPE	Code	Optional	A query about the type of resection.	ncit:C186756	_undefined_	_undefined_	_undefined_		
PD						Craniofacial Resection	A surgical procedure to remove part of the craniofacial structure.	ncit:C180345		
PD						Resection with Reconstruction	A surgical procedure to remove a diseased area and to reconstruct the area resected.	ncit:C180342		
PD						Resection without Reconstruction	A surgical procedure to remove a diseased area without reconstruction of the area resected.	ncit:C180343		
PD						Intra-Articular Resection	A resection performed within a joint.	ncit:C175015		
PD						Extra-Articular Resection	A resection that is done outside the joint.	ncit:C175016		
PD						Axial Skeleton Resection	A surgical procedure to remove part of the axial skeleton.	ncit:C180344		
PD						Intercalary Resection	A resection of a diaphyseal segment with the goal of preserving adjacent joints. This may include portions of the metaphysis and/or epiphysis depending on the extent of disease.	ncit:C175017		
PD						Internal Hemipelvectomy	Unilateral removal of the pelvic girdle by resecting the innominate bone while preserving the ipsilateral limb.	ncit:C175013		
PD						External Hemipelvectomy	Unilateral removal of the pelvic girdle by resection of the innominate bone plus amputation of the ipsilateral limb.	ncit:C175014		
PD						Unknown	Reported as unknown by the data contributor.	ncit:C17998		
PD						Not Reported	Not provided or available.	ncit:C43234		
VD	RECONSTRUCTION_TYPE	Code	Optional	Surgical restoration of function or form of a part.	ncit:C25351	_undefined_	_undefined_	_undefined_		
PD						Endoprosthetic	An artificial device inserted to replace a missing part.	ncit:C175018		
PD						Osteoarticular Allograft	Grafting bone and cartilage that has been obtained from an individual of the same species as the intended recipient.	ncit:C175019		
PD						Intercalary Allograft	Grafting a segment of long bone that is obtained from an individual of the same species as the intended recipient.	ncit:C175020		
PD						Allograft-Prosthetic	Grafting a composite of an allograft and a prosthetic device.	ncit:C175021		
PD						Non-Vascularized Autograft	Harvesting a graft from the intended recipient that has no attached blood supply.	ncit:C175022		
PD						Vascularized Autograft	Harvesting a graft from the intended recipient that has attached blood supply.	ncit:C175023		
PD						Allograft and Vascularized Autograft	The combination of a bone graft from a donor of the same species and a graft from the intended recipient that has attached arteries and veins.	ncit:C175024		
PD						Vascularized Autograft Endoprosthetic Composite	The combination of a graft from the intended recipient that has attached arteries and veins and a prosthetic device intended for implant.	ncit:C175025		
PD						Arthrodesis	Surgical fixation or immobilization of a joint, performed to allow bones to fuse or join together.	ncit:C52007		
PD						No Reconstruction	There was no surgical reconstruction performed.	ncit:C175026		
PD						Other	Different than the one(s) previously specified or mentioned.	ncit:C17649		
PD						Unknown	Reported as unknown by the data contributor.	ncit:C17998		
PD						Not Reported	Not provided or available.	ncit:C43234		
VD	PROCEDURE_EXTENT	Code	Optional	The degree to which the lesion has been cut out, or resected.	ncit:C157443	_undefined_	_undefined_	_undefined_		
PD						Gross Total	Surgical removal of an entire visible lesion, with no obvious lesion detected on post-operative evaluation; microscopic residual disease may be present.	ncit:C131672		
PD						Complete Resection	Complete clearance of the tumor with histologically proved negative margins.	ncit:C175027		
PD						Partial Resection	Surgical removal of a part of a lesion; some portion of the lesion is detectable on post-operative evaluation.	ncit:C131680		
PD						Unknown	Reported as unknown by the data contributor.	ncit:C17998		
PD						Not Reported	Not provided or available.	ncit:C43234		
VD	MARGINS	Code	Optional	One of the criteria for assessment of the effectiveness of given surgical procedure in achieving the local control of a neoplasm and the adequacy of tumor removal. It is defined by the tissue plane through which the dissection has been done and the actual or potential neoplastic tissue which has been left outside the boundary of a resected specimen within the patient. There are four types of surgical margins: intracapsular or intralesional, marginal, wide, and radical.	ncit:C41227	_undefined_	_undefined_	_undefined_		
PD						R0 - Complete Resection, Negative Margins	No detectable presence of residual tumor after treatment	ncit:C139578		
PD						R1 - Complete Resection, Positive Margins	Presence of microscopic residual tumor after treatment.	ncit:C139579		
PD						R2 - Gross Residual Disease	Presence of macroscopic residual tumor after treatment.	ncit:C139580		
PD						Unknown	Reported as unknown by the data contributor.	ncit:C17998		
